name,email,country,language,city,instagram,phone,organization,type,notes
Emirates Nature-WWF,,ARE,en,Dubai,@ews_wwf,,,other,Leading environmental NGO in UAE
Dubai Future Foundation,,ARE,en,Dubai,@dubaifuture,,,other,Promotes sustainable innovation in Dubai
Dubai Municipality,,ARE,en,Dubai,@dubaimunicipality,,,other,Oversees city environmental policies
Dubai Carbon Centre of Excellence,,ARE,en,Dubai,@dubaicarbon,,,other,Focuses on carbon reduction initiatives
The Sustainable City,,ARE,en,Dubai,@thesustainablecity,,,other,Eco-friendly residential community
Dubai Electricity and Water Authority (DEWA),,ARE,en,Dubai,@dewaofficial,,,other,Promotes sustainable energy solutions
Dubai International Humanitarian City,,ARE,en,Dubai,@ihc_uae,,,other,Supports global humanitarian efforts
Arab Youth Climate Movement,,ARE,en,Dubai,@aycmuae,,,other,Youth-led climate action group
Clean Energy Business Council,,ARE,en,Dubai,@cebc_uae,,,other,Promotes clean energy in MENA region
Dubai Chamber Sustainability Network,,ARE,en,Dubai,@dubaichamber,,,other,Business network for sustainability
Gulf for Good,,ARE,en,Dubai,@gulfforgood,,,other,Charity supporting global causes
Emirates Environmental Group,,ARE,en,Dubai,@emirateseg,,,other,Environmental awareness and action group
Dubai Expo 2020 Sustainability Pavilion,,ARE,en,Dubai,@expo2020dubai,,,other,Showcases sustainable innovations
Middle East Solar Industry Association,,ARE,en,Dubai,@mesia_me,,,other,Advocates for solar energy adoption
Dubai Cares,,ARE,en,Dubai,@dubaicares,,,other,Focuses on education and development
Greenpeace Middle East and North Africa,,ARE,en,Dubai,@greenpeace_mena,,,other,Environmental activism in MENA
International Renewable Energy Agency (IRENA),,ARE,en,Dubai,@irenaimages,,,other,Promotes global renewable energy
Dubai Sustainable Tourism,,ARE,en,Dubai,@dubaitourism,,,other,Promotes eco-friendly tourism
Dubai Science Park,,ARE,en,Dubai,@dubaisciencepark,,,other,Supports sustainable science initiatives
Dubai Green Economy Partnership,,ARE,en,Dubai,@greeneconomyuae,,,other,Promotes green economy initiatives
Dubai Desert Conservation Reserve,,ARE,en,Dubai,@ddcr_official,,,other,Conserves desert biodiversity
Dubai Centre for Risk and Innovation,,ARE,en,Dubai,@dcri_dubai,,,other,Focuses on risk management and innovation
Dubai International Financial Centre (DIFC),,ARE,en,Dubai,@difc,,,other,Supports sustainable finance initiatives
Dubai Climate Change Conference,,ARE,en,Dubai,@dubaiclimatechange,,,other,Hosts climate change discussions
Dubai Youth Council,,ARE,en,Dubai,@dubaicouncil,,,other,Engages youth in civic initiatives
Dubai International Peace Convention,,ARE,en,Dubai,@dubaiconvention,,,other,Promotes peace and dialogue
Dubai Institute of Design and Innovation,,ARE,en,Dubai,@didi_dubai,,,other,Focuses on sustainable design
Dubai International Humanitarian Aid & Development Conference,,ARE,en,Dubai,@dihae_dubai,,,other,Discusses humanitarian aid strategies
Dubai International Academic City,,ARE,en,Dubai,@diac_uae,,,other,Promotes academic research on sustainability
Dubai International Film Festival,,ARE,en,Dubai,@dubaifilm,,,other,Features films on global issues
Dubai International Boat Show,,ARE,en,Dubai,@dubaiintlboatshow,,,other,Promotes marine conservation
Dubai International Horse Fair,,ARE,en,Dubai,@dubaiequestrian,,,other,Focuses on equine welfare
Dubai International Jewellery Week,,ARE,en,Dubai,@dubaijewelleryweek,,,other,Promotes ethical sourcing
Dubai International Motor Show,,ARE,en,Dubai,@dubaicars,,,other,Showcases sustainable automotive tech
Dubai International Property Show,,ARE,en,Dubai,@dubaipropertyshow,,,other,Focuses on sustainable real estate
Dubai International Sports Conference,,ARE,en,Dubai,@dubaisports,,,other,Discusses sports and sustainability
Dubai International Trade Fair,,ARE,en,Dubai,@dubaifair,,,other,Promotes sustainable trade practices
Dubai International Water Conference,,ARE,en,Dubai,@dubaiwater,,,other,Discusses water conservation strategies
Dubai International Yoga Festival,,ARE,en,Dubai,@dubaiyogafest,,,other,Promotes wellness and peace
Dubai International Zayed Future Energy Prize,,ARE,en,Dubai,@zayedfutureenergy,,,other,Awards for sustainable energy solutions
Dubai International Zoo,,ARE,en,Dubai,@dubaizoo,,,other,Focuses on wildlife conservation
Dubai Knowledge Village,,ARE,en,Dubai,@dubaiknowledge,,,other,Promotes education on sustainability
Dubai Land Department,,ARE,en,Dubai,@dubailand,,,other,Focuses on sustainable urban development
Dubai Marina Yacht Club,,ARE,en,Dubai,@dubaimarinayachtclub,,,other,Promotes marine conservation
Dubai Media City,,ARE,en,Dubai,@dubaimediacity,,,other,Supports media on global issues
Dubai Museum of the Future,,ARE,en,Dubai,@museumofthefuture,,,other,Showcases future sustainability innovations
Dubai Parks and Resorts,,ARE,en,Dubai,@dubaiparksresorts,,,other,Focuses on eco-friendly entertainment
Dubai Police,,ARE,en,Dubai,@dubaipolicehq,,,other,Promotes community safety initiatives
Dubai Ports World,,ARE,en,Dubai,@dp_world,,,other,Focuses on sustainable logistics
Dubai Silicon Oasis Authority,,ARE,en,Dubai,@dubaisilic,,,other,Promotes tech for sustainability
Dubai Sports City,,ARE,en,Dubai,@dsc_dubai,,,other,Focuses on sustainable sports facilities
Dubai Technology Entrepreneur Centre,,ARE,en,Dubai,@dtec_dubai,,,other,Supports tech startups for sustainability
Dubai Transport Authority,,ARE,en,Dubai,@rta_dubai,,,other,Promotes sustainable transport solutions
Dubai Water Canal,,ARE,en,Dubai,@dubaicanal,,,other,Focuses on water conservation
Dubai World Trade Centre,,ARE,en,Dubai,@dwtc,,,other,Hosts events on global issues
Emirates Airline Festival of Literature,,ARE,en,Dubai,@emirateslitfest,,,other,Features authors on global issues
Emirates Aviation University,,ARE,en,Dubai,@emiratesaviationuniversity,,,other,Focuses on sustainable aviation
Emirates Foundation,,ARE,en,Dubai,@emiratesfoundation,,,other,Supports youth and community development
Emirates Green Building Council,,ARE,en,Dubai,@emiratesgbc,,,other,Promotes sustainable building practices
Emirates Marine Environmental Group,,ARE,en,Dubai,@emeg_uae,,,other,Focuses on marine conservation
Emirates NBD,,ARE,en,Dubai,@emiratesnbd_bank,,,other,Supports sustainable finance initiatives
Emirates Nuclear Energy Corporation,,ARE,en,Dubai,@enec_uae,,,other,Focuses on clean energy solutions
Emirates Red Crescent,,ARE,en,Dubai,@emiratesrc,,,other,Provides humanitarian aid
Energy and Environment Park (ENPARK),,ARE,en,Dubai,@enpark,,,other,Supports clean energy businesses
Etihad Energy Services Company,,ARE,en,Dubai,@etihadesco,,,other,Focuses on energy efficiency solutions
Friends of Cancer Patients,,ARE,en,Dubai,@focpuae,,,other,Supports cancer awareness and care
GEMS Education,,ARE,en,Dubai,@gemseducation,,,other,Promotes sustainability in education
Gulf Cooperation Council (GCC),,ARE,en,Dubai,@gcc,,,other,Regional political and economic union
Gulf News,,ARE,en,Dubai,@gulf_news,,,other,Covers regional environmental issues
Hamdan Bin Mohammed Smart University,,ARE,en,Dubai,@hbmsu,,,other,Focuses on smart learning and sustainability
Jumeirah Group,,ARE,en,Dubai,@jumeirahgroup,,,other,Focuses on sustainable hospitality
Khalifa University,,ARE,en,Dubai,@khalifa_university,,,other,Researches sustainable technologies
Knowledge and Human Development Authority,,ARE,en,Dubai,@khda,,,other,Promotes education on sustainability
Masdar City,,ARE,en,Dubai,@masdarcity,,,other,Focuses on sustainable urban development
Ministry of Climate Change and Environment,,ARE,en,Dubai,@moccae_uae,,,other,Oversees UAE's environmental policies
Ministry of Energy and Infrastructure,,ARE,en,Dubai,@moeiuae,,,other,Focuses on sustainable infrastructure
Ministry of Foreign Affairs and International Cooperation,,ARE,en,Dubai,@mofaicuae,,,other,Handles UAE's international relations
Ministry of Health and Prevention,,ARE,en,Dubai,@mohapuae,,,other,Promotes public health initiatives
Ministry of Human Resources and Emiratisation,,ARE,en,Dubai,@mohre_uae,,,other,Focuses on workforce sustainability
Ministry of Interior,,ARE,en,Dubai,@moiuae,,,other,Ensures community safety and security
Ministry of Tolerance and Coexistence,,ARE,en,Dubai,@uaetolerance,,,other,Promotes peace and coexistence
Mohammed Bin Rashid Al Maktoum Foundation,,ARE,en,Dubai,@mbrf_uae,,,other,Supports knowledge and development
Mohammed Bin Rashid Space Centre,,ARE,en,Dubai,@mbrspacecentre,,,other,Focuses on space and sustainability
National Media Council,,ARE,en,Dubai,@nmcuae,,,other,Regulates media on global issues
Ras Al Khaimah Tourism Development Authority,,ARE,en,Dubai,@raktda,,,other,Promotes sustainable tourism
Sharjah Investment and Development Authority,,ARE,en,Dubai,@shurooq,,,other,Focuses on sustainable investments
Sheikh Mohammed Centre for Cultural Understanding,,ARE,en,Dubai,@smccudubai,,,other,Promotes cultural dialogue and peace
The Green Sheikh,,ARE,en,Dubai,@greensheikh,,,other,Advocates for environmental sustainability
The National Newspaper,,ARE,en,Dubai,@thenationaluae,,,other,Covers regional environmental issues
UAE Space Agency,,ARE,en,Dubai,@uaespaceagency,,,other,Focuses on space and sustainability
United Nations Development Programme UAE,,ARE,en,Dubai,@undpuae,,,other,Supports sustainable development goals
World Green Building Council MENA,,ARE,en,Dubai,@worldgbc,,,other,Promotes sustainable building practices
World Wildlife Fund UAE,,ARE,en,Dubai,@wwf_uae,,,other,Focuses on wildlife conservation
Clean Energy Business Council,,ARE,en,Dubai,@cebcmena,,Clean Energy Business Council,other,Promotes clean energy in MENA region
Dubai International Humanitarian Aid & Development,,ARE,en,Dubai,@dihadubai,,DIHAD,other,Hosts humanitarian aid conferences
Middle East Institute,,ARE,en,Dubai,@mei.mideast,,Middle East Institute,other,Focuses on regional geopolitics
Dubai Desert Conservation Reserve,,ARE,en,Dubai,@ddcr_uae,,Dubai Desert Conservation Reserve,other,Protects desert biodiversity
Dubai Astronomy Group,,ARE,en,Dubai,@dubaiastronomy,,Dubai Astronomy Group,other,Promotes space and environmental awareness
Dubai Culture,,ARE,en,Dubai,@dubaiculture,,Dubai Culture,other,Promotes cultural sustainability
Dubai Science Park,,ARE,en,Dubai,@dubaibiotech,,Dubai Science Park,other,Supports biotech and sustainability
