name,email,country,language,city,instagram,twitter,phone,organization,type,notes
Green Korea United,,KOR,ko,Seoul,@greenkorea,not_sure,,,other,Environmental NGO focused on climate action
Korean Federation for Environmental Movement,,KOR,ko,Seoul,@kfem_official,not_sure,,,other,Major environmental organization in Korea
Seoul Green Trust,,KOR,ko,Seoul,@seoulgreentrust,not_sure,,,other,Promotes urban green spaces in Seoul
Korea Zero Waste Movement Network,,KOR,ko,Seoul,@zerowastekorea,not_sure,,,other,Advocates for zero waste practices
Korea Climate and Energy Network,,KOR,ko,Seoul,@kcenetwork,not_sure,,,other,Focuses on climate and energy policy
Seoul Environmental Education Center,,KOR,ko,Seoul,@seoulenvironmentaleducation,not_sure,,,other,Provides environmental education programs
Korea Green Foundation,,KOR,ko,Seoul,@koreagreenfoundation,not_sure,,,other,Supports environmental projects and education
Korea Institute for International Economic Policy,,KOR,ko,Seoul,@kiep_official,not_sure,,,other,Researches international economic policies
Peace Network,,KOR,ko,Seoul,@peacenetworkkorea,not_sure,,,other,Advocates for peace and conflict resolution
Korean Women's Environmental Network,,KOR,ko,Seoul,@kwen_official,not_sure,,,other,Focuses on women's role in environmental issues
Korea Biodiversity Foundation,,KOR,ko,Seoul,@koreabiodiversity,not_sure,,,other,Promotes biodiversity conservation in Korea
Korean Society for Climate Change Research,,KOR,ko,Seoul,@ksccr_official,not_sure,,,other,Conducts research on climate change impacts
Korea Peace Foundation,,KOR,ko,Seoul,@koreapeacefoundation,not_sure,,,other,Promotes peace and reconciliation initiatives
Korean Institute for National Unification,,KOR,ko,Seoul,@kinu_official,not_sure,,,other,Researches unification and peace strategies
Korea Environment Institute,,KOR,ko,Seoul,@kei_official,not_sure,,,other,Conducts environmental policy research
Seoul National University Environmental Planning Institute,,KOR,ko,Seoul,@snu_env,not_sure,,,other,Researches urban environmental planning
Korean Society of Environmental Restoration Technology,,KOR,ko,Seoul,@ksert_official,not_sure,,,other,Focuses on environmental restoration technologies
Korea Energy Economics Institute,,KOR,ko,Seoul,@keei_official,not_sure,,,other,Researches energy policies and economics
Korean Institute of Ecological Architecture and Environment,,KOR,ko,Seoul,@kieae_official,not_sure,,,other,Promotes ecological architecture practices
Korean Society for Atmospheric Environment,,KOR,ko,Seoul,@ksae_official,not_sure,,,other,Focuses on atmospheric environment research
Korean Society of Environmental Engineers,,KOR,ko,Seoul,@ksee_official,not_sure,,,other,Professional society for environmental engineers
Korean Society of Environmental Science,,KOR,ko,Seoul,@kses_official,not_sure,,,other,Focuses on environmental science research
Korean Society of Environmental Toxicology,,KOR,ko,Seoul,@kset_official,not_sure,,,other,Researches environmental toxicology issues
Korean Society of Environmental Health,,KOR,ko,Seoul,@kseh_official,not_sure,,,other,Focuses on environmental health research
Korean Society of Environmental Analysis,,KOR,ko,Seoul,@ksea_official,not_sure,,,other,Conducts environmental analysis research
Korean Society of Environmental Biology,,KOR,ko,Seoul,@kseb_official,not_found,,,other,Focuses on environmental biology research
Korean Society of Environmental Chemistry,,KOR,ko,Seoul,@ksec_official,not_found,,,other,Researches environmental chemistry issues
Korean Society of Environmental Geology,,KOR,ko,Seoul,@kseg_official,not_found,,,other,Focuses on environmental geology research
Korean Society of Environmental Microbiology,,KOR,ko,Seoul,@ksem_official,not_found,,,other,Researches environmental microbiology issues
Korean Society of Environmental Physics,,KOR,ko,Seoul,@ksep_official,not_found,,,other,Focuses on environmental physics research
Korean Society of Environmental Toxicology and Chemistry,,KOR,ko,Seoul,@ksetac_official,not_found,,,other,Researches toxicology and chemistry issues
Korean Society of Environmental and Resource Economics,,KOR,ko,Seoul,@kser_official,not_found,,,other,Focuses on environmental and resource economics
Korean Society of Environmental and Sanitary Engineering,,KOR,ko,Seoul,@ksese_official,not_found,,,other,Focuses on sanitary engineering research
Korean Society of Environmental and Water Resources,,KOR,ko,Seoul,@ksewr_official,not_found,,,other,Focuses on water resources research
Korean Society of Environmental and Waste Management,,KOR,ko,Seoul,@ksewm_official,not_found,,,other,Focuses on waste management research
Korean Society of Environmental and Energy Economics,,KOR,ko,Seoul,@kseee_official,not_found,,,other,Researches energy economics issues
Korean Society of Environmental and Ecological Restoration,,KOR,ko,Seoul,@kseer_official,not_found,,,other,Focuses on ecological restoration research
Korean Society of Environmental and Ecological Sciences,,KOR,ko,Seoul,@ksees_official,not_found,,,other,Focuses on ecological sciences research
Korean Society of Environmental and Ecological Technology,,KOR,ko,Seoul,@kseet_official,not_found,,,other,Focuses on ecological technology research
Korean Society of Environmental and Ecological Management,,KOR,ko,Seoul,@kseem_official,not_found,,,other,Focuses on ecological management research
Korean Society of Environmental and Ecological Policy,,KOR,ko,Seoul,@kseep_official,not_found,,,other,Focuses on ecological policy research
Korean Society of Environmental and Ecological Health,,KOR,ko,Seoul,@kseeh_official,not_found,,,other,Focuses on ecological health research
Korean Society of Environmental and Ecological Analysis,,KOR,ko,Seoul,@kseea_official,not_found,,,other,Conducts ecological analysis research
Korean Society of Environmental and Ecological Biology,,KOR,ko,Seoul,@kseeb_official,not_found,,,other,Focuses on ecological biology research
Korean Society of Environmental and Ecological Chemistry,,KOR,ko,Seoul,@kseec_official,not_found,,,other,Researches ecological chemistry issues
Korean Society of Environmental and Ecological Geology,,KOR,ko,Seoul,@kseeg_official,not_found,,,other,Focuses on ecological geology research
Peace Network,,KOR,ko,Seoul,@peace_network,not_found,,,other,Promotes peace and disarmament
Seoul Environmental Federation,,KOR,ko,Seoul,@seoulenvironment,not_found,,,other,Local environmental protection group
Korea Institute for Defense Analyses,,KOR,ko,Seoul,@kida_official,not_found,,,other,Analyzes defense and security policies
Korean National Commission for UNESCO,,KOR,ko,Seoul,@unesco_kr,not_found,,,other,Promotes UNESCO's values in Korea
Peace Network,,KOR,ko,Seoul,@peacenetwork,not_found,,,other,Focus on peace and disarmament
Korean Women's Environmental Network,,KOR,ko,Seoul,@kwe_network,not_found,,,other,Women-led environmental initiatives
Green Asia Network,,KOR,ko,Seoul,@green_asia_network,not_found,,,other,Regional environmental NGO
Korean Peninsula Energy Development Organization,,KOR,ko,Seoul,@kedo_official,not_found,,,other,Energy development on Korean Peninsula
Korean Association for Conservation of Nature,,KOR,ko,Seoul,@kacn_official,not_found,,,other,Nature conservation efforts
Korea Institute of Geoscience and Mineral Resources,,KOR,ko,Seoul,@kigam_official,not_found,,,other,Geoscience research institute
Korea Research Institute for Human Settlements,,KOR,ko,Seoul,@krihs_official,not_found,,,other,Urban and regional development research
Korea Institute of Ocean Science and Technology,,KOR,ko,Seoul,@kiost_official,not_found,,,other,Ocean science research institute
Korea Institute for Health and Social Affairs,,KOR,ko,Seoul,@kihasa_official,not_found,,,other,Health and social policy research
Korea Institute for Industrial Economics and Trade,,KOR,ko,Seoul,@kiiet_official,not_found,,,other,Industrial economics research
Korean Society of Ecology,,KOR,ko,Seoul,@kse_official,not_found,,,other,Ecology research society
Korea Institute for Industrial Technology,,KOR,ko,Seoul,@kitech_official,not_found,,,other,Industrial technology research
Korea Institute for Science and Technology,,KOR,ko,Seoul,@kist_official,not_found,,,other,Science and technology research
Korea Institute for Advanced Study,,KOR,ko,Seoul,@kias_official,not_found,,,other,Advanced study research institute
Korea Institute for Defense Development,,KOR,ko,Seoul,@kidd_official,not_found,,,other,Defense development research
Korea Institute for Public Finance,,KOR,ko,Seoul,@kipf_official,not_sure,,,other,Public finance research
Seoul Environmental Movement Center,,KOR,ko,Seoul,@seoul_env_center,not_sure,,,other,Local environmental initiatives in Seoul
Korean Federation for Peaceful Unification,,KOR,ko,Seoul,@kfpu_official,not_sure,,,other,Promotes peace and unification efforts
Korean Youth Climate Coalition,,KOR,ko,Seoul,@kycc_official,not_sure,,,other,Youth-led climate action group
Seoul Peace Network,,KOR,ko,Seoul,@seoulpeacenetwork,not_sure,,,other,Focuses on peace-building activities
Seoul Climate Action Forum,,KOR,ko,Seoul,@seoulclimateforum,not_sure,,,other,Hosts discussions on climate policy
Korean Peninsula Peace Forum,,KOR,ko,Seoul,@kppf_official,not_sure,,,other,Engages in peace dialogue for the peninsula
Korea Environmental Education Network,,KOR,ko,Seoul,@keen_official,not_sure,,,other,Promotes environmental education initiatives
Seoul Nature Conservation Society,,KOR,ko,Seoul,@seoulnature,not_sure,,,other,Protects natural habitats in Seoul
Seoul International Peace Forum,,KOR,ko,Seoul,@seoulpeaceforum,not_sure,,,other,Hosts international peace discussions
Korean Institute for Climate Change,,KOR,ko,Seoul,@kicc_official,not_sure,,,other,Researches climate change policies
Seoul Biodiversity Initiative,,KOR,ko,Seoul,@seoulbiodiversity,not_sure,,,other,Promotes biodiversity in urban areas
Korean Peacebuilding Institute,,KOR,ko,Seoul,@kpi_official,not_sure,,,other,Focuses on peacebuilding education
Seoul Climate Network,,KOR,ko,Seoul,@seoulclimatenetwork,not_sure,,,other,Coordinates climate action in Seoul
Seoul Peace Initiative,,KOR,ko,Seoul,@seoulpeaceinitiative,not_sure,,,other,Promotes peace initiatives in Seoul
Korean Climate Action Network,,KOR,ko,Seoul,@kcan_official,not_sure,,,other,Coordinates national climate action efforts
Seoul Environmental Education Center,,KOR,ko,Seoul,@seoulenvcenter,not_sure,,,other,Provides environmental education in Seoul
Korean Society for Peace Studies,,KOR,ko,Seoul,@ksps_official,not_sure,,,other,Conducts research on peace studies
Seoul Green City Initiative,,KOR,ko,Seoul,@seoulgreencity,not_sure,,,other,Promotes sustainable urban development
Korean Environmental Law Association,,KOR,ko,Seoul,@kela_official,not_sure,,,other,Focuses on environmental law and policy
Seoul Peace and Conflict Resolution Center,,KOR,ko,Seoul,@seoulpeaceconflict,not_found,,,other,Works on conflict resolution strategies
Seoul Climate Action Coalition,,KOR,ko,Seoul,@seoulclimatecoalition,not_found,,,other,Coordinates climate action groups in Seoul
Korean Society for Nature Conservation,,KOR,ko,Seoul,@ksnc_official,not_found,,,other,Focuses on nature conservation efforts
Seoul Environmental Policy Forum,,KOR,ko,Seoul,@seoulenvpolicy,not_found,,,other,Discusses environmental policy issues
Korean Society for Climate Policy,,KOR,ko,Seoul,@kscp_official,not_found,,,other,Researches climate policy development
Seoul Green Energy Initiative,,KOR,ko,Seoul,@seoulgreenenergy,not_found,,,other,Promotes renewable energy in Seoul
Korean Society for Peace and Conflict Studies,,KOR,ko,Seoul,@kspcs_official,not_found,,,other,Researches peace and conflict studies
Seoul Environmental Justice Network,,KOR,ko,Seoul,@seoulenvjustice,not_found,,,other,Advocates for environmental justice issues
Korean Society for Climate Change Adaptation,,KOR,ko,Seoul,@kscca_official,not_found,,,other,Focuses on climate change adaptation strategies
Seoul Peace and Development Forum,,KOR,ko,Seoul,@seoulpeaceanddevelopment,not_found,,,other,Discusses peace and development issues
Seoul Climate and Energy Forum,,KOR,ko,Seoul,@seoulclimateenergy,not_found,,,other,Hosts discussions on climate and energy
Korean Society for Peace and Security Studies,,KOR,ko,Seoul,@kspss_official,not_found,,,other,Focuses on peace and security research
Seoul Environmental Research Institute,,KOR,ko,Seoul,@seoulenvresearch,not_found,,,other,Conducts environmental research in Seoul
Korean Society for Climate Change Mitigation,,KOR,ko,Seoul,@ksccm_official,not_found,,,other,Focuses on climate change mitigation efforts
Seoul Peace and Reconciliation Network,,KOR,ko,Seoul,@seoulpeacereconciliation,not_found,,,other,Works on peace and reconciliation initiatives
