name,email,country,language,city,instagram,phone,organization,type,notes
Fundación Terram,,CHL,es,Santiago,@fundacionterram,,,ngo,Focus on environmental policy and advocacy
Greenpeace Chile,,CHL,es,Santiago,@greenpeacecl,,,ngo,Global NGO with local climate initiatives
Fundación Basura,,CHL,es,Santiago,@fundacionbasura,,,ngo,Promotes zero waste and sustainability
CODEFF,,CHL,es,Santiago,@codeffchile,,,ngo,Oldest environmental NGO in Chile
Fundación Fungi,,CHL,es,Santiago,@fundacionfungi,,,ngo,Conserves Chilean fungi biodiversity
Fundación Huilo Huilo,,CHL,es,Santiago,@fundacionhuilohuilo,,,ngo,Conservation in the Patagonian rainforest
Fundación Casa de la Paz,,CHL,es,Santiago,@casadelapaz,,,ngo,Focus on sustainable development and peace
Fundación Lepe,,CHL,es,Santiago,@fundacionlepe,,,ngo,Supports rural development and sustainability
Fundación Chile,,CHL,es,Santiago,@fundacionchile,,,ngo,Innovates in sustainability and technology
Fundación Avina,,CHL,es,Santiago,@fundacionavina,,,ngo,Promotes sustainable development in Latin America
Fundación Kennedy,,CHL,es,Santiago,@fundacionkennedy,,,ngo,Conserves wetlands and biodiversity
Fundación Altiplano,,CHL,es,Santiago,@fundacionaltiplano,,,ngo,Cultural and natural heritage conservation
Fundación Ronda,,CHL,es,Santiago,@fundacionronda,,,ngo,Promotes social inclusion and sustainability
Fundación Sendero de Chile,,CHL,es,Santiago,@senderodechile,,,ngo,Develops sustainable tourism and conservation
Fundación Pumalín,,CHL,es,Santiago,@fundacionpumalin,,,ngo,Conserves Patagonian ecosystems
Fundación Mar Adentro,,CHL,es,Santiago,@fundacionmaradentro,,,ngo,Integrates art and nature conservation
Fundación Senda Darwin,,CHL,es,Santiago,@sendadarwin,,,ngo,Biodiversity research and conservation
Fundación Reforestemos,,CHL,es,Santiago,@reforestemos,,,ngo,Reforestation and environmental education
Fundación Huella Local,,CHL,es,Santiago,@huellalocal,,,ngo,Local development and sustainability projects
Fundación Proyecta Memoria,,CHL,es,Santiago,@proyectamemoria,,,ngo,Preserves historical memory and peace
Fundación Huilo Huilo,,CHL,es,Santiago,@huilohuilo,,,ngo,Conservation and sustainable tourism in Patagonia
Fundación Ríos to Rivers,,CHL,es,Santiago,@riostorivers,,,ngo,Focus on river conservation and youth education
Fundación Patagonia Sur,,CHL,es,Santiago,@patagoniasur,,,ngo,Conservation and sustainable development in Patagonia
Fundación Tierra Austral,,CHL,es,Santiago,@fundaciontierraaustral,,,ngo,Land conservation and environmental education
Fundación Huinay,,CHL,es,Santiago,@fundacionhuinay,,,ngo,Marine and terrestrial research and conservation
Fundación Alerce 3000,,CHL,es,Santiago,@alerce3000,,,ngo,Conservation of ancient Alerce trees
Fundación Futuro,,CHL,es,Santiago,@fundacionfuturo,,,ngo,Promotes cultural and environmental awareness
Fundación La Fuente,,CHL,es,Santiago,@fundacionlafuente,,,ngo,Cultural and environmental education projects
Fundación Ciudadano Inteligente,,CHL,es,Santiago,@ciudadanointeligente,,,ngo,Promotes transparency and civic engagement
Fundación Iguales,,CHL,es,Santiago,@fundacioniguales,,,ngo,LGBTQ+ rights and social inclusion
Fundación ProHumana,,CHL,es,Santiago,@prohumana,,,ngo,Corporate social responsibility and sustainability
Fundación Superación de la Pobreza,,CHL,es,Santiago,@superaciondelapobreza,,,ngo,Poverty alleviation and social development
Fundación Trascender,,CHL,es,Santiago,@fundaciontrascender,,,ngo,Volunteerism and social impact projects
Fundación Vivienda,,CHL,es,Santiago,@fundacionvivienda,,,ngo,Affordable housing and community development
Fundación Mi Parque,,CHL,es,Santiago,@miparque,,,ngo,Urban green spaces and community engagement
Fundación Todo Mejora,,CHL,es,Santiago,@todomejora,,,ngo,Youth mental health and LGBTQ+ support
Fundación América Solidaria,,CHL,es,Santiago,@americasolidaria,,,ngo,International development and social justice
Fundación Colunga,,CHL,es,Santiago,@fundacioncolunga,,,ngo,Social innovation and poverty reduction
Fundación Trilema,,CHL,es,Santiago,@fundaciontrilema,,,ngo,Education and social inclusion projects
Fundación Sol,,CHL,es,Santiago,@fundacionsol,,,ngo,Labor rights and economic research
Fundación Educación 2020,,CHL,es,Santiago,@educacion2020,,,ngo,Education reform and policy advocacy
Fundación Chile Sustentable,,CHL,es,Santiago,@chilesustentable,,,ngo,Sustainable development and environmental policy
Fundación Proyecta,,CHL,es,Santiago,@fundacionproyecta,,,ngo,Youth leadership and civic engagement
Fundación Democracia y Desarrollo,,CHL,es,Santiago,@fundaciondyc,,,ngo,Democracy and sustainable development
Fundación Crecer,,CHL,es,Santiago,@fundacioncrecer,,,ngo,Child development and education programs
Fundación Templanza,,CHL,es,Santiago,@fundaciontemplaza,,,ngo,Mental health and community support
Fundación Chile Lagos Limpios,,CHL,es,Santiago,@chilelagoslimpios,,,ngo,Water conservation and lake protection
Fundación Proyecto Propio,,CHL,es,Santiago,@proyectopropio,,,ngo,Social entrepreneurship and innovation
Fundación Chile Verde,,CHL,es,Santiago,@chileverde,,,ngo,Environmental education and green initiatives
Fundación Chile Sin Basura,,CHL,es,Santiago,@chilesinbasura,,,ngo,Waste reduction and recycling advocacy
Greenpeace Chile,,CHL,es,Santiago,@greenpeacechile,,,ngo,International NGO with local environmental campaigns
Fundación Mar Adentro,,CHL,es,Santiago,@maradentrochile,,,ngo,Art and science for environmental awareness
Fundación Ecoscience,,CHL,es,Santiago,@fundacionecoscience,,,ngo,Science-based environmental conservation
Fundación Proyecto Ser Humano,,CHL,es,Santiago,@proyectoserhumano,,,ngo,Human rights and environmental advocacy
Fundación Pro Bono,,CHL,es,Santiago,@fundacionprobono,,,ngo,Legal assistance and social justice
Fundación Emilia,,CHL,es,Santiago,@fundacionemilia,,,ngo,Road safety and accident prevention
CODEFF,,CHL,es,Santiago,@codeff_chile,,,ngo,Oldest environmental NGO in Chile
Fundación Huilo Huilo,,CHL,es,Santiago,@huilohuilofundacion,,,ngo,Conservation and sustainable development
Fundación Crecer con Todos,,CHL,es,Santiago,@crecercontodos,,,ngo,Education and early childhood development
Fundación Toki,,CHL,es,Santiago,@fundaciontoki,,,ngo,Cultural and educational projects on Easter Island
Fundación Nativo Digital,,CHL,es,Santiago,@nativodigital,,,ngo,Digital literacy and education
Fundación Desafío Levantemos Chile,,CHL,es,Santiago,@desafiochile,,,ngo,Disaster relief and community development
