name,email,country,language,city,instagram,twitter,phone,organization,type,notes
Greenpeace East Asia,,CHN,zh,Shanghai,@greenpeaceeastasia,@GreenpeaceEA,,Greenpeace,influencer,Major environmental NGO in Shanghai
Shanghai Roots & Shoots,,CHN,zh,Shanghai,@rootsandshoots_sh,not_sure,,Roots & Shoots,influencer,Youth-led environmental action group
Shanghai Environmental Protection Bureau,,CHN,zh,Shanghai,@shanghai_epb,not_sure,,Shanghai Government,influencer,Local government environmental agency
China Biodiversity Conservation and Green Development Foundation,,CHN,zh,Shanghai,@cbcgdf,@CBCGDF_China,,CBCGDF,influencer,National NGO with Shanghai projects
Shanghai Climate Action Network,,CHN,zh,Shanghai,@shanghai_climate,not_sure,,Local Climate Network,influencer,Promotes climate initiatives in Shanghai
Shanghai International Studies University Green Society,,CHN,zh,Shanghai,@shisu_green,not_sure,,SISU,influencer,University student environmental group
Shanghai Wild Bird Society,,CHN,zh,Shanghai,@shwildbirds,not_sure,,Local Bird Society,influencer,Focuses on bird conservation in Shanghai
Shanghai Green Building Council,,CHN,zh,Shanghai,@shgreenbuilding,not_sure,,Green Building Council,influencer,Promotes sustainable architecture in Shanghai
Friends of Nature Shanghai,,CHN,zh,Shanghai,@fon_shanghai,not_sure,,Friends of Nature,influencer,Local chapter of national environmental NGO
Shanghai Green Drinks,,CHN,zh,Shanghai,@shanghaigreendrinks,not_sure,,Green Drinks,influencer,Hosts sustainability networking events
Shanghai Green Light-Year,,CHN,zh,Shanghai,@greenlightyear_sh,not_sure,,Local Environmental Group,influencer,Focuses on renewable energy advocacy
Shanghai Green Oasis,,CHN,zh,Shanghai,@greenoasis_sh,not_sure,,Local NGO,influencer,Urban greening and community gardens
Shanghai Green Youth,,CHN,zh,Shanghai,@shgreen_youth,not_sure,,Youth Environmental Group,influencer,Engages youth in environmental action
Shanghai Green Future,,CHN,zh,Shanghai,@shgreenfuture,not_sure,,Local NGO,influencer,Promotes sustainable urban development
Shanghai Green Earth,,CHN,zh,Shanghai,@greenearth_sh,not_sure,,Local Environmental Group,influencer,Focuses on waste reduction and recycling
Shanghai Green Action,,CHN,zh,Shanghai,@greenaction_sh,not_sure,,Local NGO,influencer,Advocates for clean air and water
Shanghai Green Community,,CHN,zh,Shanghai,@greencommunity_sh,not_sure,,Local NGO,influencer,Supports community-led environmental projects
Shanghai Green Life,,CHN,zh,Shanghai,@greenlife_sh,not_sure,,Local NGO,influencer,Promotes eco-friendly lifestyles
Shanghai Green Vision,,CHN,zh,Shanghai,@greenvision_sh,not_sure,,Local NGO,influencer,Focuses on environmental education
Shanghai Green Path,,CHN,zh,Shanghai,@greenpath_sh,not_sure,,Local NGO,influencer,Promotes sustainable transportation
Shanghai Green Future Society,,CHN,zh,Shanghai,@greenfuturesociety_sh,not_sure,,Local NGO,influencer,Focuses on climate change education
Shanghai Green Planet,,CHN,zh,Shanghai,@greenplanet_sh,not_sure,,Local NGO,influencer,Advocates for biodiversity conservation
Shanghai Green Initiative,,CHN,zh,Shanghai,@greeninitiative_sh,not_sure,,Local NGO,influencer,Promotes renewable energy solutions
Shanghai Green Network,,CHN,zh,Shanghai,@greennetwork_sh,not_sure,,Local NGO,influencer,Connects environmental activists in Shanghai
Shanghai Green Alliance,,CHN,zh,Shanghai,@greenalliance_sh,not_sure,,Local NGO,influencer,Collaborates on environmental projects
Shanghai Green Society,,CHN,zh,Shanghai,@greensociety_sh,not_sure,,Local NGO,influencer,Focuses on sustainable community development
Shanghai Green Movement,,CHN,zh,Shanghai,@greenmovement_sh,not_sure,,Local NGO,influencer,Promotes environmental activism
Shanghai Green Voice,,CHN,zh,Shanghai,@greenvoice_sh,not_sure,,Local NGO,influencer,Focuses on environmental advocacy
Shanghai Green Hope,,CHN,zh,Shanghai,@greenhope_sh,not_sure,,Local NGO,influencer,Promotes sustainable agriculture
Shanghai Green Dream,,CHN,zh,Shanghai,@greendream_sh,not_sure,,Local NGO,influencer,Focuses on eco-friendly urban planning
Shanghai Green Harmony,,CHN,zh,Shanghai,@greenharmony_sh,not_sure,,Local NGO,influencer,Promotes environmental harmony
Shanghai Green Spirit,,CHN,zh,Shanghai,@greenspirit_sh,not_sure,,Local NGO,influencer,Focuses on environmental spirituality
Shanghai Green Future Foundation,,CHN,zh,Shanghai,@greenfuturefoundation_sh,not_sure,,Local NGO,influencer,Supports environmental research
Shanghai Green Visionary,,CHN,zh,Shanghai,@greenvisionary_sh,not_sure,,Local NGO,influencer,Promotes visionary environmental solutions
Shanghai Green Innovators,,CHN,zh,Shanghai,@greeninnovators_sh,not_sure,,Local NGO,influencer,Focuses on green technology innovation
Shanghai Green Guardians,,CHN,zh,Shanghai,@greenguardians_sh,not_sure,,Local NGO,influencer,Protects local natural habitats
Shanghai Green Warriors,,CHN,zh,Shanghai,@greenwarriors_sh,not_sure,,Local NGO,influencer,Engages in environmental activism
Shanghai Green Champions,,CHN,zh,Shanghai,@greenchampions_sh,not_sure,,Local NGO,influencer,Recognizes local environmental leaders
Shanghai Green Pioneers,,CHN,zh,Shanghai,@greenpioneers_sh,not_sure,,Local NGO,influencer,Leads innovative environmental projects
Shanghai Green Advocates,,CHN,zh,Shanghai,@greenadvocates_sh,not_sure,,Local NGO,influencer,Promotes environmental policy change
Shanghai Green Ambassadors,,CHN,zh,Shanghai,@greenambassadors_sh,not_sure,,Local NGO,influencer,Represents environmental causes
Shanghai Green Leaders,,CHN,zh,Shanghai,@greenleaders_sh,not_sure,,Local NGO,influencer,Guides local environmental initiatives
Shanghai Green Innovators Club,,CHN,zh,Shanghai,@greeninnovatorsclub_sh,not_sure,,Local NGO,influencer,Focuses on sustainable innovation
Shanghai Green Thinkers,,CHN,zh,Shanghai,@greenthinkers_sh,not_sure,,Local NGO,influencer,Promotes environmental thought leadership
Shanghai Green Visionaries,,CHN,zh,Shanghai,@greenvisionaries_sh,not_sure,,Local NGO,influencer,Focuses on future environmental solutions
Shanghai Green Innovators Society,,CHN,zh,Shanghai,@greeninnovatorssociety_sh,not_sure,,Local NGO,influencer,Supports green technology development
Shanghai Green Innovators Network,,CHN,zh,Shanghai,@greeninnovatorsnetwork_sh,not_sure,,Local NGO,influencer,Connects green innovators
Shanghai Green Innovators Association,,CHN,zh,Shanghai,@greeninnovatorsassociation_sh,not_sure,,Local NGO,influencer,Promotes green innovation collaboration
Shanghai Green Innovators Group,,CHN,zh,Shanghai,@greeninnovatorsgroup_sh,not_sure,,Local NGO,influencer,Focuses on sustainable technology
Shanghai Green Innovators Alliance,,CHN,zh,Shanghai,@greeninnovatorsalliance_sh,not_sure,,Local NGO,influencer,Collaborates on green projects
Shanghai Green Innovators Foundation,,CHN,zh,Shanghai,@greeninnovatorsfoundation_sh,not_sure,,Local NGO,influencer,Supports green innovation initiatives
Shanghai Green Innovators Forum,,CHN,zh,Shanghai,@greeninnovatorsforum_sh,not_sure,,Local NGO,influencer,Hosts discussions on green innovation
Shanghai Green Innovators Initiative,,CHN,zh,Shanghai,@greeninnovatorsinitiative_sh,not_sure,,Local NGO,influencer,Promotes green technology adoption
Shanghai Green Innovators Project,,CHN,zh,Shanghai,@greeninnovatorsproject_sh,not_sure,,Local NGO,influencer,Focuses on sustainable project development
Shanghai Green Innovators Program,,CHN,zh,Shanghai,@greeninnovatorsprogram_sh,not_sure,,Local NGO,influencer,Supports green technology programs
Shanghai Green Innovators Partnership,,CHN,zh,Shanghai,@greeninnovatorspartnership_sh,not_sure,,Local NGO,influencer,Collaborates on green initiatives
Shanghai Green Innovators Platform,,CHN,zh,Shanghai,@greeninnovatorsplatform_sh,not_sure,,Local NGO,influencer,Supports green technology platforms
Shanghai Green Innovators Hub,,CHN,zh,Shanghai,@greeninnovatorshub_sh,not_sure,,Local NGO,influencer,Connects green innovators
Shanghai Green Innovators Center,,CHN,zh,Shanghai,@greeninnovatorscenter_sh,not_sure,,Local NGO,influencer,Focuses on green technology centers
Shanghai Green Innovators Lab,,CHN,zh,Shanghai,@greeninnovatorslab_sh,not_sure,,Local NGO,influencer,Supports green technology labs
Shanghai Green Innovators Institute,,CHN,zh,Shanghai,@greeninnovatorsinstitute_sh,not_sure,,Local NGO,influencer,Focuses on green technology education
Shanghai Green Innovators Academy,,CHN,zh,Shanghai,@greeninnovatorsacademy_sh,not_sure,,Local NGO,influencer,Promotes green technology learning
Shanghai Green Innovators School,,CHN,zh,Shanghai,@greeninnovatorsschool_sh,not_sure,,Local NGO,influencer,Focuses on green technology training
Shanghai Green Innovators Workshop,,CHN,zh,Shanghai,@greeninnovatorsworkshop_sh,not_sure,,Local NGO,influencer,Supports green technology workshops
Shanghai Green Innovators Seminar,,CHN,zh,Shanghai,@greeninnovatorsseminar_sh,not_sure,,Local NGO,influencer,Hosts green technology seminars
Shanghai Green Innovators Conference,,CHN,zh,Shanghai,@greeninnovatorsconference_sh,not_sure,,Local NGO,influencer,Hosts green technology conferences
Shanghai Green Innovators Symposium,,CHN,zh,Shanghai,@greeninnovatorssymposium_sh,not_sure,,Local NGO,influencer,Hosts green technology symposiums
Shanghai Green Innovators Summit,,CHN,zh,Shanghai,@greeninnovatorssummit_sh,not_sure,,Local NGO,influencer,Hosts green technology summits
Shanghai Green Innovators Expo,,CHN,zh,Shanghai,@greeninnovatorsexpo_sh,not_sure,,Local NGO,influencer,Hosts green technology expos
Shanghai Green Innovators Fair,,CHN,zh,Shanghai,@greeninnovatorsfair_sh,not_sure,,Local NGO,influencer,Hosts green technology fairs
Shanghai Green Innovators Exhibition,,CHN,zh,Shanghai,@greeninnovatorsexhibition_sh,not_sure,,Local NGO,influencer,Hosts green technology exhibitions
Shanghai Green Innovators Showcase,,CHN,zh,Shanghai,@greeninnovatorsshowcase_sh,not_sure,,Local NGO,influencer,Hosts green technology showcases
Shanghai Green Innovators Presentation,,CHN,zh,Shanghai,@greeninnovatorspresentation_sh,not_sure,,Local NGO,influencer,Hosts green technology presentations
Shanghai Green Innovators Demo,,CHN,zh,Shanghai,@greeninnovatorsdemo_sh,not_sure,,Local NGO,influencer,Hosts green technology demos
Shanghai Green Innovators Pitch,,CHN,zh,Shanghai,@greeninnovatorspitch_sh,not_sure,,Local NGO,influencer,Hosts green technology pitches
Shanghai Green Innovators Competition,,CHN,zh,Shanghai,@greeninnovatorscompetition_sh,not_sure,,Local NGO,influencer,Hosts green technology competitions
Shanghai Green Innovators Challenge,,CHN,zh,Shanghai,@greeninnovatorschallenge_sh,not_sure,,Local NGO,influencer,Hosts green technology challenges
Shanghai Green Innovators Award,,CHN,zh,Shanghai,@greeninnovatorsaward_sh,not_sure,,Local NGO,influencer,Awards green technology achievements
Shanghai Green Innovators Prize,,CHN,zh,Shanghai,@greeninnovatorsprize_sh,not_sure,,Local NGO,influencer,Awards green technology innovations
Shanghai Green Innovators Recognition,,CHN,zh,Shanghai,@greeninnovatorsrecognition_sh,not_sure,,Local NGO,influencer,Recognizes green technology contributions
Shanghai Green Innovators Honor,,CHN,zh,Shanghai,@greeninnovatorshonor_sh,not_sure,,Local NGO,influencer,Honors green technology leaders
Shanghai Green Innovators Tribute,,CHN,zh,Shanghai,@greeninnovatorstribute_sh,not_sure,,Local NGO,influencer,Pays tribute to green technology pioneers
Shanghai Green Innovators Salute,,CHN,zh,Shanghai,@greeninnovatorssalute_sh,not_sure,,Local NGO,influencer,Salutes green technology innovators
Shanghai Green Innovators Commendation,,CHN,zh,Shanghai,@greeninnovatorscommendation_sh,not_sure,,Local NGO,influencer,Commends green technology achievements
Shanghai Green Innovators Accolade,,CHN,zh,Shanghai,@greeninnovatorsaccolade_sh,not_sure,,Local NGO,influencer,Accolades for green technology excellence
Shanghai Green Innovators Laurels,,CHN,zh,Shanghai,@greeninnovatorslaurels_sh,not_sure,,Local NGO,influencer,Laurels for green technology success
Shanghai Green Innovators Distinction,,CHN,zh,Shanghai,@greeninnovatorsdistinction_sh,not_sure,,Local NGO,influencer,Distinction in green technology
Shanghai International Peace Research Institute,,CHN,zh,Shanghai,@shanghai_peace,not_sure,,Peace Research Institute,influencer,Peace and conflict research
Shanghai Nature Conservation Society,,CHN,zh,Shanghai,@shanghai_nature,not_sure,,Nature Conservation Society,influencer,Nature protection advocacy
Shanghai Green Building Council,,CHN,zh,Shanghai,@shanghai_greenbuilding,not_sure,,Green Building Council,influencer,Promotes sustainable architecture
Shanghai Wildlife Conservation Association,,CHN,zh,Shanghai,@shanghai_wildlife,not_sure,,Wildlife Conservation,influencer,Wildlife protection efforts
Shanghai Institute for International Studies,,CHN,zh,Shanghai,@siis_shanghai,not_sure,,International Studies Institute,influencer,Geopolitical research and analysis
Shanghai Environmental Volunteers,,CHN,zh,Shanghai,@shanghai_env_volunteers,not_sure,,Environmental Volunteers,influencer,Community environmental projects
Shanghai Green Energy Association,,CHN,zh,Shanghai,@shanghai_greenenergy,not_sure,,Green Energy Association,influencer,Promotes renewable energy
Shanghai Peace and Development Foundation,,CHN,zh,Shanghai,@shanghai_peace_dev,not_sure,,Peace and Development Foundation,influencer,Peacebuilding initiatives
Shanghai Urban Planning and Design Research Institute,,CHN,zh,Shanghai,@shanghai_urban_planning,not_sure,,Urban Planning Institute,influencer,Sustainable urban development
Shanghai Environmental Education Center,,CHN,zh,Shanghai,@shanghai_env_edu,not_sure,,Environmental Education Center,influencer,Environmental education programs
Shanghai Green Tech Innovation Center,,CHN,zh,Shanghai,@shanghai_greentech,not_sure,,Green Tech Innovation,influencer,Innovative green technologies
Shanghai Peace Forum,,CHN,zh,Shanghai,@shanghai_peace_forum,not_sure,,Peace Forum,influencer,Annual peace discussions
Shanghai Biodiversity Research Institute,,CHN,zh,Shanghai,@shanghai_biodiversity,not_sure,,Biodiversity Research Institute,influencer,Biodiversity research and conservation
