name,email,country,language,city,instagram,phone,organization,type,notes
Fundación Natura Colombia,,COL,es,Bogota,@fundacionnaturacolombia,,Fundación Natura,other,Conservation and biodiversity NGO in Bogotá
Red de Jóvenes de Ambiente,,COL,es,Bogota,@redjovenesambiente,,Red de Jóvenes de Ambiente,other,Youth network for environmental action
CEMPRE Colombia,,COL,es,Bogota,@cemprecolombia,,CEMPRE,other,Promotes recycling and sustainability
WWF Colombia,,COL,es,Bogota,@wwfcolombia,,WWF,other,Global conservation organization with Bogotá presence
Greenpeace Colombia,,COL,es,Bogota,@greenpeacecolombia,,Greenpeace,other,Environmental activism and campaigns
Instituto Humboldt,,COL,es,Bogota,@institutohumboldt,,Instituto Humboldt,other,Research on biodiversity and ecosystems
Parques Nacionales Naturales de Colombia,,COL,es,Bogota,@parquescolombia,,Parques Nacionales,other,Manages national parks and conservation areas
Colombia Climática,,COL,es,Bogota,@colombiaclimatica,,Colombia Climática,other,Focus on climate change education
C40 Cities Bogotá,,COL,es,Bogota,@c40cities,,C40 Cities,other,Global network of cities tackling climate change
Fundación Cerros de Bogotá,,COL,es,Bogota,@cerrosdebogota,,Fundación Cerros de Bogotá,other,Protects Bogotá's surrounding hills
Red de Mujeres Ambientalistas,,COL,es,Bogota,@redmujeresambientalistas,,Red de Mujeres Ambientalistas,other,Women-led environmental advocacy
EcoPetrol,,COL,es,Bogota,@ecopetrolsa,,EcoPetrol,other,National oil company with sustainability initiatives
Fundación Al Verde Vivo,,COL,es,Bogota,@alverdevivo,,Fundación Al Verde Vivo,other,Promotes urban agriculture and green spaces
Bogotá Cómo Vamos,,COL,es,Bogota,@bogotacomovamos,,Bogotá Cómo Vamos,other,Monitors city development and sustainability
Fundación Humedales Bogotá,,COL,es,Bogota,@humedalesbogota,,Fundación Humedales Bogotá,other,Conserves urban wetlands
Cámara de Comercio de Bogotá,,COL,es,Bogota,@camaracomerciobogota,,Cámara de Comercio de Bogotá,other,Supports sustainable business practices
Universidad de los Andes,,COL,es,Bogota,@uniandes,,Universidad de los Andes,other,Research on climate and sustainability
Universidad Nacional de Colombia,,COL,es,Bogota,@unalcolombia,,Universidad Nacional de Colombia,other,Environmental research and education
Fundación Gilberto Alzate Avendaño,,COL,es,Bogota,@fgaa_bogota,,Fundación Gilberto Alzate Avendaño,other,Cultural and environmental projects
Corporación Autónoma Regional de Cundinamarca,,COL,es,Bogota,@car_cundinamarca,,CAR Cundinamarca,other,Regional environmental authority
Fundación Planeta Azul,,COL,es,Bogota,@fundacionplanetaazul,,Fundación Planeta Azul,other,Water conservation and education
Fundación Gaia Amazonas,,COL,es,Bogota,@gaiaamazonas,,Fundación Gaia Amazonas,other,Supports Amazon conservation and indigenous rights
Fundación para la Conservación y el Desarrollo Sostenible,,COL,es,Bogota,@fcdscolombia,,FCDS,other,Focus on sustainable development
Fundación Natura Colombia,,COL,es,Bogota,@fundacionnatura,,Fundación Natura,other,Prominent environmental NGO in Colombia
Greenpeace Colombia,,COL,es,Bogota,@greenpeacecol,,Greenpeace,other,International environmental NGO active in Colombia
Censat Agua Viva,,COL,es,Bogota,@censataguaviva,,Censat Agua Viva,other,Focuses on water conservation and rights
Red de Agricultura Urbana de Bogotá,,COL,es,Bogota,@redagriculturaurbana,,Red de Agricultura Urbana,other,Promotes urban agriculture and sustainability
Fundación Al Verde Vivo,,COL,es,Bogota,@fundacionalverdevivo,,,other,Promotes urban agriculture and sustainability
Corporación Ambiental Empresarial,,COL,es,Bogota,@cae_colombia,,,other,Supports sustainable business practices
Fundación Omacha,,COL,es,Bogota,@fundacionomacha,,,other,Conserves aquatic ecosystems and species
Fundación ProAves,,COL,es,Bogota,@proavescolombia,,,other,Bird conservation organization in Colombia
Fundación Tropenbos Colombia,,COL,es,Bogota,@tropenboscolombia,,,other,Focuses on forest conservation and research
Fundación Bioparque La Reserva,,COL,es,Bogota,@bioparquelare,,,other,Environmental education and conservation center
Fundación Caminos de Identidad,,COL,es,Bogota,@fundacioncaminos,,,other,Supports indigenous communities and biodiversity
Fundación Ecológica Cafam,,COL,es,Bogota,@fundacioncafam,,,other,Promotes environmental education and conservation
Conservación Internacional Colombia,,COL,es,Bogota,@conservacioncol,,Conservación Internacional,other,Focuses on biodiversity and sustainable development
Fundación Orinoquia,,COL,es,Bogota,@fundacionorinoquia,,Fundación Orinoquia,other,Promotes sustainable development in Orinoquía region
Fundación Vida Silvestre,,COL,es,Bogota,@fundacionvidas,,Fundación Vida Silvestre,other,Conserves wildlife and natural habitats
Red de Reservas Naturales de la Sociedad Civil,,COL,es,Bogota,@reservasnaturales,,Red de Reservas Naturales,other,Network of private nature reserves
Sociedad Colombiana de Ecología,,COL,es,Bogota,@sociedadcolombianadeecologia,,Sociedad Colombiana de Ecología,other,Promotes ecological research and education
The Nature Conservancy Colombia,,COL,es,Bogota,@tnc_colombia,,The Nature Conservancy,other,Global NGO with local conservation projects
Universidad de los Andes - Centro de Estudios de la Orinoquía,,COL,es,Bogota,@ceo_uniandes,,Universidad de los Andes,other,Research center on Orinoquía region
Universidad Nacional de Colombia - Instituto de Estudios Ambientales,,COL,es,Bogota,@iea_unal,,Universidad Nacional,other,Focuses on environmental studies and research
Universidad Javeriana - Instituto de Estudios Ambientales,,COL,es,Bogota,@iea_javeriana,,Universidad Javeriana,other,Environmental research and education
Universidad del Rosario - Centro de Estudios en Geopolítica,,COL,es,Bogota,@cegeo_rosario,,Universidad del Rosario,other,Research on geopolitics and international affairs
Universidad Externado de Colombia - Centro de Estudios sobre Desarrollo Sostenible,,COL,es,Bogota,@desarrolloexternado,,Universidad Externado,other,Focuses on sustainable development studies
Universidad de La Sabana - Centro de Investigación en Medio Ambiente,,COL,es,Bogota,@cima_unisabana,,Universidad de La Sabana,other,Research on environmental issues
Universidad de Bogotá Jorge Tadeo Lozano - Facultad de Ciencias Naturales,,COL,es,Bogota,@cienciasnaturalesutadeo,,Universidad Jorge Tadeo Lozano,other,Focuses on natural sciences research
Universidad Militar Nueva Granada - Centro de Estudios en Geopolítica,,COL,es,Bogota,@cegeo_unimilitar,,Universidad Militar Nueva Granada,other,Geopolitical research and education
Universidad de Ciencias Aplicadas y Ambientales - Facultad de Ciencias Ambientales,,COL,es,Bogota,@cienciasambientalesudca,,Universidad de Ciencias Aplicadas y Ambientales,other,Environmental sciences education and research
Universidad EAN - Facultad de Estudios Ambientales,,COL,es,Bogota,@estudiosambientales_ean,,Universidad EAN,other,Focuses on environmental studies
Universidad de La Salle - Facultad de Ciencias Agropecuarias,,COL,es,Bogota,@cienciasagropecuarias_lasalle,,Universidad de La Salle,other,Research on agricultural sciences
Universidad Santo Tomás - Facultad de Ciencias Ambientales,,COL,es,Bogota,@cienciasambientales_ust,,Universidad Santo Tomás,other,Environmental sciences education
Universidad Central - Facultad de Ciencias Sociales,,COL,es,Bogota,@cienciassociales_ucentral,,Universidad Central,other,Focuses on social sciences research
Universidad de San Buenaventura - Facultad de Ciencias Humanas y Sociales,,COL,es,Bogota,@cienciashumanas_usb,,Universidad de San Buenaventura,other,Research on human and social sciences
Universidad Piloto de Colombia - Facultad de Ciencias Sociales,,COL,es,Bogota,@cienciassociales_upc,,Universidad Piloto de Colombia,other,Social sciences education and research
Universidad de Ciencias Ambientales y Aplicadas - Facultad de Ciencias Ambientales,,COL,es,Bogota,@cienciasambientales_udca,,Universidad de Ciencias Ambientales y Aplicadas,other,Focuses on environmental sciences
