name,email,country,language,city,instagram,phone,organization,type,notes
Greenpeace Japan,,JPN,ja,Tokyo,@greenpeacejp,,,ngo,Environmental protection and climate action
WWF Japan,,JPN,ja,Tokyo,@wwfjapan,,,ngo,Nature conservation and biodiversity
Friends of the Earth Japan,,JPN,ja,Tokyo,@foejapan,,,ngo,Focus on climate and energy issues
Japan Environmental Action Network (JEAN),,JPN,ja,Tokyo,@jean_japan,,,ngo,Marine and coastal environment protection
Peace Boat,,JPN,ja,Tokyo,@peaceboatofficial,,,ngo,Peace and sustainability education
Japan Climate Initiative,,JPN,ja,Tokyo,@japanclimateinitiative,,,ngo,Climate action network in Japan
Institute for Sustainable Energy Policies (ISEP),,JPN,ja,Tokyo,@isep_japan,,,ngo,Renewable energy advocacy
Japan Center for a Sustainable Environment and Society (JACSES),,JPN,ja,Tokyo,@jacses_japan,,,ngo,Environmental policy and advocacy
Tokyo Urban Permaculture,,JPN,ja,Tokyo,@tokyourbanpermaculture,,,ngo,Urban sustainability and permaculture
350.org Japan,,JPN,ja,Tokyo,@350japan,,,ngo,Climate change activism
Japan Youth Platform for Sustainability,,JPN,ja,Tokyo,@japan_yps,,,ngo,Youth-led sustainability initiatives
Citizens' Nuclear Information Center,,JPN,ja,Tokyo,@cnicjapan,,,ngo,Nuclear energy and safety advocacy
Japan Association for Refugees,,JPN,ja,Tokyo,@japanrefugees,,,ngo,Support for refugees and asylum seekers
Human Rights Now,,JPN,ja,Tokyo,@humanrightsnow,,,ngo,Human rights advocacy and education
Japan NGO Center for International Cooperation (JANIC),,JPN,ja,Tokyo,@janic_japan,,,ngo,International cooperation and development
Green Earth Network,,JPN,ja,Tokyo,@greenearthnetwork,,,ngo,Environmental conservation and education
Japan Wildlife Conservation Society,,JPN,ja,Tokyo,@jwcs_japan,,,ngo,Wildlife protection and conservation
Japan Civil Network for Disaster Relief in East Japan,,JPN,ja,Tokyo,@jcn_japan,,,ngo,Disaster relief and recovery
Tokyo River Friends,,JPN,ja,Tokyo,@tokyoriverfriends,,,ngo,River clean-up and conservation
Japan International Volunteer Center,,JPN,ja,Tokyo,@jivc_japan,,,ngo,International volunteer projects and aid
Japan Environmental Education Forum,,JPN,ja,Tokyo,@jeef_japan,,,ngo,Environmental education and awareness
Tokyo Green Space,,JPN,ja,Tokyo,@tokyogreenspace,,,ngo,Urban green space advocacy
Japan Network for Climate Change Actions,,JPN,ja,Tokyo,@jncca_japan,,,ngo,Climate change policy and action
Japan Biodiversity Fund,,JPN,ja,Tokyo,@japanbiodiversityfund,,,ngo,Biodiversity conservation and funding
Tokyo Peace Film Festival,,JPN,ja,Tokyo,@tokyopeacefilm,,,ngo,Peace and conflict resolution through film
Japan Organic Agriculture Association,,JPN,ja,Tokyo,@joaa_japan,,,ngo,Promotion of organic farming practices
Tokyo Environmental Information Center,,JPN,ja,Tokyo,@tokyoeic,,,ngo,Environmental information and resources
Japan Society for International Development,,JPN,ja,Tokyo,@jsid_japan,,,ngo,International development and cooperation
Tokyo Sustainability Forum,,JPN,ja,Tokyo,@tokyosustainabilityforum,,,ngo,Sustainability discussions and initiatives
Japan Water Forum,,JPN,ja,Tokyo,@japanwaterforum,,,ngo,Water resource management and policy
Tokyo Climate Action Network,,JPN,ja,Tokyo,@tokyoclimatenetwork,,,ngo,Local climate action and advocacy
Japan Renewable Energy Foundation,,JPN,ja,Tokyo,@jref_japan,,,ngo,Promotion of renewable energy solutions
Tokyo Peace and Justice Center,,JPN,ja,Tokyo,@tokyopeacejustice,,,ngo,Peacebuilding and justice advocacy
Japan Ecotourism Society,,JPN,ja,Tokyo,@japanecotourism,,,ngo,Promotion of sustainable tourism
Tokyo Environmental Design Group,,JPN,ja,Tokyo,@tokyoenvironmentaldesign,,,ngo,Environmental design and urban planning
Japan Society for the Promotion of Science,,JPN,ja,Tokyo,@jsps_japan,,,ngo,Scientific research and collaboration
Tokyo Green Drinks,,JPN,ja,Tokyo,@tokyogreendrinks,,,ngo,Networking for sustainability professionals
Japan Environmental Lawyers Federation,,JPN,ja,Tokyo,@jelf_japan,,,ngo,Environmental law and policy advocacy
Tokyo Green Building Council,,JPN,ja,Tokyo,@tokyogbc,,,ngo,Sustainable building practices
Japan Environmental Management Association for Industry,,JPN,ja,Tokyo,@jemai_japan,,,ngo,Environmental management in industry
Tokyo Environmental Research Institute,,JPN,ja,Tokyo,@tokyoeri,,,ngo,Environmental research and development
Japan Society for Environmental Chemistry,,JPN,ja,Tokyo,@jsec_japan,,,ngo,Environmental chemistry research
Tokyo Environmental Education Network,,JPN,ja,Tokyo,@tokyoeen,,,ngo,Environmental education initiatives
Japan Society for Environmental Economics and Policy Studies,,JPN,ja,Tokyo,@jseep_japan,,,ngo,Environmental economics and policy research
Tokyo Environmental Policy Institute,,JPN,ja,Tokyo,@tokyoepi,,,ngo,Environmental policy analysis and advocacy
Japan Society for Environmental Restoration and Conservation,,JPN,ja,Tokyo,@jserc_japan,,,ngo,Environmental restoration projects
Tokyo Environmental Volunteers,,JPN,ja,Tokyo,@tokyoenvironmentalvolunteers,,,ngo,Volunteer activities for environmental causes
Japan Society for Environmental Science,,JPN,ja,Tokyo,@jses_japan,,,ngo,Environmental science research and education
Tokyo Environmental Health Association,,JPN,ja,Tokyo,@tokyoeha,,,ngo,Environmental health advocacy
Japan Society for Environmental Sociology,,JPN,ja,Tokyo,@jsesoc_japan,,,ngo,Environmental sociology research
Tokyo Environmental Protection Agency,,JPN,ja,Tokyo,@tokyoepa,,,ngo,Environmental protection and regulation
Japan Society for Environmental Technology,,JPN,ja,Tokyo,@jset_japan,,,ngo,Environmental technology development
Tokyo Environmental Planning Group,,JPN,ja,Tokyo,@tokyoepg,,,ngo,Environmental planning and policy
Japan Society for Environmental Toxicology,,JPN,ja,Tokyo,@jsetox_japan,,,ngo,Environmental toxicology research
Tokyo Environmental Conservation Society,,JPN,ja,Tokyo,@tokyoecs,,,ngo,Environmental conservation projects
Japan Society for Environmental Education,,JPN,ja,Tokyo,@jsee_japan,,,ngo,Environmental education programs
Tokyo Environmental Science Association,,JPN,ja,Tokyo,@tokyoesa,,,ngo,Environmental science research and advocacy
Japan Society for Environmental Microbiology,,JPN,ja,Tokyo,@jsem_japan,,,ngo,Environmental microbiology research
Japan Society for Environmental Biotechnology,,JPN,ja,Tokyo,@jseb_japan,,,ngo,Environmental biotechnology research
Tokyo Environmental Management Group,,JPN,ja,Tokyo,@tokyoemg,,,ngo,Environmental management practices
Japan Society for Environmental Geology,,JPN,ja,Tokyo,@jseg_japan,,,ngo,Environmental geology research
Tokyo Environmental Design Association,,JPN,ja,Tokyo,@tokyoeda,,,ngo,Environmental design and architecture
Japan Society for Environmental Hydrology,,JPN,ja,Tokyo,@jseh_japan,,,ngo,Environmental hydrology research
Tokyo Environmental Research Group,,JPN,ja,Tokyo,@tokyoerg,,,ngo,Environmental research and studies
Japan Society for Environmental Physics,,JPN,ja,Tokyo,@jsep_japan,,,ngo,Environmental physics research
Tokyo Environmental Design Group,,JPN,ja,Tokyo,@tokyoedg,,,ngo,Environmental design and planning
Tokyo Environmental Health Group,,JPN,ja,Tokyo,@tokyoehg,,,ngo,Environmental health research
Tokyo Environmental Conservation Group,,JPN,ja,Tokyo,@tokyoecg,,,ngo,Conservation and environmental protection
Tokyo Environmental Science Group,,JPN,ja,Tokyo,@tokyoesg,,,ngo,Environmental science and research
Greenpeace Japan,,JPN,ja,Tokyo,@greenpeace_japan,,,ngo,Environmental advocacy and campaigns in Tokyo
Peace Boat,,JPN,ja,Tokyo,@peace_boat,,,ngo,Promotes peace and sustainability through global voyages
Rainforest Action Network Japan,,JPN,ja,Tokyo,@ran_japan,,,ngo,Protects forests and indigenous rights
Tokyo Zero Waste Academy,,JPN,ja,Tokyo,@tokyozerowaste,,,ngo,Promotes zero waste lifestyle in Tokyo
Citizens' Nuclear Information Center,,JPN,ja,Tokyo,@cnic_japan,,,ngo,Nuclear safety and policy advocacy
Japan Civil Network for Disaster Relief,,JPN,ja,Tokyo,@jcn_disasterrelief,,,ngo,Disaster relief and preparedness
Japan International Volunteer Center,,JPN,ja,Tokyo,@jvc_japan,,,ngo,International development and volunteerism
Tokyo Environmental Information Center,,JPN,ja,Tokyo,@tokyo_eic,,,ngo,Environmental education and information dissemination
Japan Youth Ecology League,,JPN,ja,Tokyo,@jyecology,,,ngo,Youth-led environmental action and education
Japan Biodiversity Fund,,JPN,ja,Tokyo,@japanbiodiversity,,,ngo,Supports biodiversity projects and research
Tokyo Climate Action Network,,JPN,ja,Tokyo,@tokyoclimateaction,,,ngo,Local climate action and policy advocacy
Japan Peace Committee,,JPN,ja,Tokyo,@japanpeacecommittee,,,ngo,Peace promotion and anti-war advocacy
Tokyo Environmental Citizens' Network,,JPN,ja,Tokyo,@tokyoecn,,,ngo,Environmental advocacy and citizen engagement
Tokyo Wildlife Conservation Society,,JPN,ja,Tokyo,@tokyowildlife,,,ngo,Wildlife conservation and habitat protection
Tokyo Environmental Education Forum,,JPN,ja,Tokyo,@tokyoeef,,,ngo,Environmental education and awareness programs
Japan Peace and Conflict Studies Association,,JPN,ja,Tokyo,@japanpeaceconflict,,,ngo,Research and advocacy on peace and conflict
Tokyo Peace and Development Network,,JPN,ja,Tokyo,@tokyopeaceanddev,,,ngo,Peace and development initiatives in Tokyo
Japan Green Network,,JPN,ja,Tokyo,@japangreennetwork,,,ngo,Environmental conservation and green initiatives
Tokyo Biodiversity Center,,JPN,ja,Tokyo,@tokyobiodiversity,,,ngo,Biodiversity research and conservation
Japan Peace and Security Forum,,JPN,ja,Tokyo,@japanpeaceforum,,,ngo,Dialogue on peace and security issues
Japan Network for Earth Environment and Disaster,,JPN,ja,Tokyo,@jneed_japan,,,ngo,Disaster preparedness and environmental protection
Tokyo Peace and Human Rights Network,,JPN,ja,Tokyo,@tokyopeacehr,,,ngo,Human rights and peace advocacy
Japan Peace and Development Association,,JPN,ja,Tokyo,@japanpeaceanddev,,,ngo,Development and peacebuilding initiatives
Tokyo Green Energy Promotion Council,,JPN,ja,Tokyo,@tokyogreenenergy,,,ngo,Promotes renewable energy and sustainability
Tokyo Peace and Reconciliation Network,,JPN,ja,Tokyo,@tokyopeacerecon,,,ngo,Promotes peace and reconciliation efforts
Tokyo Environmental Policy Forum,,JPN,ja,Tokyo,@tokyoepf,,,ngo,Policy dialogue on environmental issues
Japan Peace and Humanitarian Network,,JPN,ja,Tokyo,@japanpeacehumanitarian,,,ngo,Humanitarian aid and peace initiatives
Tokyo Green Infrastructure Network,,JPN,ja,Tokyo,@tokyogreeninfra,,,ngo,Promotes green infrastructure and urban sustainability
Japan Society for Peace Studies,,JPN,ja,Tokyo,@japanpeacestudies,,,ngo,Research and advocacy on peace studies
Tokyo Environmental Justice Network,,JPN,ja,Tokyo,@tokyoejn,,,ngo,Advocacy for environmental justice and equity
Japan Peace and Development Forum,,JPN,ja,Tokyo,@japanpeaceanddevforum,,,ngo,Dialogue on peace and development issues
