name,email,country,language,city,instagram,twitter,phone,organization,type,notes
Habiba Al Marashi,,ARE,en,Dubai,@habiba_al_marashi,not_sure,,Emirates Environmental Group,activist,Founder of Emirates Environmental Group
Razan Khalifa Al Mubarak,,ARE,en,Dubai,@razanalmubarak,not_sure,,International Union for Conservation of Nature,activist,"IUCN President, UAE environmental leader"
Mohammed Al Bowardi,,ARE,en,Dubai,@mohammed_albowardi,not_sure,,Environment Agency - Abu Dhabi,activist,Key figure in UAE environmental policy
Mariam bint Mohammed Saeed Hareb Almheiri,,ARE,en,Dubai,@mariambmhareb,not_sure,,UAE Minister of Climate Change and Environment,activist,UAE Minister for Climate Change
Dr. Thani bin Ahmed Al Zeyoudi,,ARE,en,Dubai,@thani_alzeyoudi,not_sure,,UAE Minister of State for Foreign Trade,activist,Former Minister of Climate Change
Ayesha Al Marzooqi,,ARE,en,Dubai,@ayesha_almarzooqi,not_sure,,Dubai Cares,activist,Advocate for education and sustainability
Ali Al Suwaidi,,ARE,en,Dubai,@ali_alsuwaidi,not_sure,,Emirates Marine Environmental Group,activist,Marine conservation leader
Nawal Al Hosany,,ARE,en,Dubai,@nawalalhosany,not_sure,,Masdar,activist,Sustainability advocate at Masdar
Dr. Shaikha Salem Al Dhaheri,,ARE,en,Dubai,@shaikha_aldhaheri,not_sure,,Environment Agency - Abu Dhabi,activist,Biodiversity conservation expert
Fatima Al Kaabi,,ARE,en,Dubai,@fatimaalkaabi,not_sure,,Youth Climate Activist,activist,Young climate activist in UAE
Khaled Al Huraimel,,ARE,en,Dubai,@khaled_alhuraimel,not_sure,,Bee'ah,activist,CEO of environmental management company
Dr. Saif Al Ghais,,ARE,en,Dubai,@dr_saif_alghais,not_sure,,Environment Protection and Development Authority,activist,Environmental protection leader
Reem Al Hashimy,,ARE,en,Dubai,@reemalhashimy,not_sure,,Expo 2020 Dubai,activist,Sustainability advocate at Expo 2020
Majid Al Suwaidi,,ARE,en,Dubai,@majid_alsuwaidi,not_sure,,UAE Climate Negotiator,activist,UAE climate negotiation leader
Dr. Eng. Mohammed Nasser Al Ahbabi,,ARE,en,Dubai,@mohammed_al_ahbabi,not_sure,,UAE Space Agency,activist,Space and environmental advocate
Hind Al Huwaidi,,ARE,en,Dubai,@hind_alhuwaidi,not_sure,,Emirates Nature-WWF,activist,Conservation leader at WWF UAE
Saeed Al Tayer,,ARE,en,Dubai,@saeed_altayer,not_sure,,Dubai Electricity and Water Authority,activist,Promotes renewable energy in Dubai
Dr. Nawal Al Hosany,,ARE,en,Dubai,@dr_nawalalhosany,not_sure,,Masdar,activist,Sustainability advocate at Masdar
Hussain Al Mahmoudi,,ARE,en,Dubai,@hussain_almahmoudi,not_sure,,Sharjah Research Technology and Innovation Park,activist,Innovation in sustainability
Dr. Lamya Fawwaz,,ARE,en,Dubai,@dr_lamyafawwaz,not_sure,,Masdar,activist,Sustainability and innovation leader
Dr. Abdulrahman Al Awar,,ARE,en,Dubai,@dr_abdulrahman_al_awar,not_sure,,UAE Ministry of Human Resources,activist,Advocate for sustainable labor practices
Dr. Mohamed Al Hammadi,,ARE,en,Dubai,@dr_mohamed_alhammadi,not_sure,,Emirates Nuclear Energy Corporation,activist,Nuclear energy and sustainability
Dr. Ali Rashid Al Nuaimi,,ARE,en,Dubai,@dr_alirashid_alnuaimi,not_sure,,Hedayah,activist,Counter-extremism and peace advocate
Dr. Nasser Saidi,,ARE,en,Dubai,@dr_nasser_saidi,not_sure,,Nasser Saidi & Associates,activist,Economic and environmental policy expert
Dr. Aisha Bin Bishr,,ARE,en,Dubai,@dr_aisha_bin_bishr,not_sure,,Smart Dubai,activist,Smart city and sustainability advocate
Dr. Thani Al Zeyoudi,,ARE,en,Dubai,@dr_thani_alzeyoudi,@ThaniAlZeyoudi,,UAE Minister of State for Foreign Trade,activist,Former Minister of Climate Change
Dr. Sultan Al Jaber,,ARE,en,Dubai,@dr_sultan_aljaber,@SultanAlJaber,,UAE Minister of Industry and Advanced Technology,activist,Energy and climate leader
Dr. Amal Al Qubaisi,,ARE,en,Dubai,@dr_amal_alqubaisi,not_sure,,Former President of the Federal National Council,activist,Advocate for peace and governance
Dr. Abdulla Al Mandous,,ARE,en,Dubai,@dr_abdulla_almandous,not_sure,,National Center of Meteorology,activist,Climate and weather expert
Dr. Mohammed Al Zarooni,,ARE,en,Dubai,@dr_mohammed_alzarooni,not_sure,,Dubai Silicon Oasis Authority,activist,Innovation and sustainability advocate
Dr. Saeed Al Hassani,,ARE,en,Dubai,@dr_saeed_alhassani,not_sure,,UAE Ministry of Education,activist,Education and sustainability leader
Dr. Ahmed Al Banna,,ARE,en,Dubai,@dr_ahmed_albanna,not_sure,,UAE Ambassador to India,activist,Diplomacy and international relations
Dr. Jamal Al Matrooshi,,ARE,en,Dubai,@dr_jamal_almatrooshi,not_sure,,Dubai Municipality,activist,Environmental management leader
Dr. Mohammed Al Hammadi,,ARE,en,Dubai,@dr_mohammed_alhammadi,not_sure,,Emirates Nuclear Energy Corporation,activist,Nuclear energy and sustainability
Mohammed Al Bowardi,,ARE,en,Dubai,@mohammed_al_bowardi,not_sure,,Environment Agency - Abu Dhabi,activist,Key figure in UAE environmental policy
Nawal Al Hosany,,ARE,en,Dubai,@nawal_alhosany,not_sure,,Masdar,activist,Advocate for renewable energy
Mariam Al Mheiri,,ARE,en,Dubai,@mariamalmehiri,@mariammalmheiri,,Minister of Climate Change and Environment,activist,Leads UAE climate policy
Nada Al Bedwawi,,ARE,en,Dubai,@nadaalbedwawi,not_sure,,Olympic Swimmer & Environmental Advocate,activist,Promotes ocean conservation
Salma Al Sharhan,,ARE,en,Dubai,@salma_alsharhan,not_sure,,Youth Climate Activist,activist,Advocates for youth involvement in climate action
Sultan Al Jaber,,ARE,en,Dubai,@sultanaljaber,@SultanAlJaber,,UAE Minister of Industry and Advanced Technology,activist,Promotes sustainable industrial practices
Alya Al Mazrouei,,ARE,en,Dubai,@alya_almazrouei,not_sure,,Environmental Advocate,activist,Focuses on sustainable urban development
Omar Al Busaidy,,ARE,en,Dubai,@omaralbusaidy,@omaralbusaidy,,Author & Speaker,activist,Advocates for sustainable business practices
Sara Al Madani,,ARE,en,Dubai,@sara_almadani_,not_sure,,Entrepreneur & Environmental Advocate,activist,Promotes eco-friendly entrepreneurship
Rashid Al Nuaimi,,ARE,en,Dubai,@rashid_alnuaimi,not_sure,,Environmental Policy Maker,activist,Focuses on sustainable policy development
Latifa Al Maktoum,,ARE,en,Dubai,@latifaalmaktoum,not_sure,,Equestrian & Environmental Advocate,activist,Promotes wildlife conservation
Mona Al Marri,,ARE,en,Dubai,@monaalmarri,not_sure,,Dubai Media Office,activist,Advocates for sustainable media practices
Faisal Al Rahmani,,ARE,en,Dubai,@faisal_alrahmani,not_sure,,Environmental Advocate,activist,Promotes biodiversity conservation
Amna Al Owais,,ARE,en,Dubai,@amna_alowais,not_sure,,Dubai Courts,activist,Advocates for environmental justice
Khalifa Al Suwaidi,,ARE,en,Dubai,@khalifa_alsuwaidi,not_sure,,Environmental Policy Advocate,activist,Focuses on sustainable policy initiatives
Hessa Al Jaber,,ARE,en,Dubai,@hessa_aljaber,not_sure,,Environmental Advocate,activist,Promotes sustainable technology solutions
Majid Al Futtaim,,ARE,en,Dubai,@majidalfuttaim,not_sure,,Majid Al Futtaim Group,activist,Promotes sustainable retail practices
Ahlam Al Shamsi,,ARE,en,Dubai,@ahlamalshamsi,not_sure,,Singer & Environmental Advocate,activist,Promotes environmental awareness through music
Abdulla Al Gurg,,ARE,en,Dubai,@abdulla_algurg,not_sure,,Environmental Advocate,activist,Focuses on sustainable business practices
Mariam Al Hammadi,,ARE,en,Dubai,@mariam_alhammadi,not_sure,,Environmental Educator,activist,Promotes environmental education initiatives
Rania Al Yasin,,ARE,en,Dubai,@rania_alyasin,not_sure,,Environmental Advocate,activist,Focuses on sustainable urban planning
Saeed Al Tayer,,ARE,en,Dubai,@saeedaltayer,not_sure,,DEWA,activist,Promotes renewable energy solutions
Laila Al Jassmi,,ARE,en,Dubai,@laila_aljassmi,not_sure,,Environmental Advocate,activist,Focuses on health and environment
Mohammed Al Gergawi,,ARE,en,Dubai,@mohammedalgergawi,not_sure,,Minister of Cabinet Affairs,activist,Promotes sustainable governance
Aisha Al Mazrouei,,ARE,en,Dubai,@aisha_almazrouei,not_sure,,Youth Climate Activist,activist,Advocates for youth climate action
Hamad Al Ameri,,ARE,en,Dubai,@hamad_alameri,not_sure,,Environmental Advocate,activist,Focuses on sustainable agriculture
Reem Al Suwaidi,,ARE,en,Dubai,@reem_alsuwaidi,not_sure,,Environmental Advocate,activist,Promotes sustainable tourism
Sultan Al Qasimi,,ARE,en,Dubai,@sultanalqasimi,not_sure,,Environmental Advocate,activist,Focuses on cultural and environmental preservation
Fatima Al Qubaisi,,ARE,en,Dubai,@fatima_alqubaisi,not_sure,,Environmental Advocate,activist,Promotes environmental law and policy
Mansoor Al Awar,,ARE,en,Dubai,@mansooralawar,not_sure,,Environmental Advocate,activist,Focuses on sustainable education
Hind Al Owais,,ARE,en,Dubai,@hindalowais,not_sure,,Environmental Advocate,activist,Promotes sustainable urban development
Abdulaziz Al Ghurair,,ARE,en,Dubai,@abdulazizalghurair,not_sure,,Environmental Advocate,activist,Focuses on sustainable finance
Mona Al Mansouri,,ARE,en,Dubai,@monaalmansouri,not_sure,,Environmental Advocate,activist,Promotes sustainable fashion
Rashid Al Maktoum,,ARE,en,Dubai,@rashidalmaktoum,not_sure,,Environmental Advocate,activist,Focuses on wildlife conservation
Amina Al Rustamani,,ARE,en,Dubai,@aminaalrustamani,not_sure,,Environmental Advocate,activist,Promotes sustainable technology
Khalid Al Qasimi,,ARE,en,Dubai,@khalidalqasimi,not_sure,,Environmental Advocate,activist,Focuses on cultural and environmental preservation
Fatima Al Mulla,,ARE,en,Dubai,@fatimaal_mulla,not_sure,,Environmental Advocate,activist,Promotes environmental education
Saeed Al Mansoori,,ARE,en,Dubai,@saeedalmansoori,not_sure,,Environmental Advocate,activist,Focuses on renewable energy
Hessa Al Suwaidi,,ARE,en,Dubai,@hessa_alsuwaidi,not_sure,,Environmental Advocate,activist,Promotes sustainable agriculture
Mariam Al Qasimi,,ARE,en,Dubai,@mariam_alqasimi,not_sure,,Environmental Advocate,activist,Focuses on cultural and environmental preservation
Omar Al Maktoum,,ARE,en,Dubai,@omaralmaktoum,not_sure,,Environmental Advocate,activist,Promotes wildlife conservation
Aisha Al Gurg,,ARE,en,Dubai,@aisha_algurg,not_sure,,Environmental Advocate,activist,Focuses on sustainable business practices
Hind Al Mulla,,ARE,en,Dubai,@hindalmulla,not_sure,,Environmental Advocate,activist,Promotes environmental education
Abdullah Al Mansoori,,ARE,en,Dubai,@abdullahalmansoori,not_sure,,Environmental Advocate,activist,Focuses on renewable energy
Latifa Al Suwaidi,,ARE,en,Dubai,@latifa_alsuwaidi,not_sure,,Environmental Advocate,activist,Promotes sustainable agriculture
Mona Al Qasimi,,ARE,en,Dubai,@mona_alqasimi,not_sure,,Environmental Advocate,activist,Focuses on cultural and environmental preservation
Rashid Al Mulla,,ARE,en,Dubai,@rashidalmulla,not_sure,,Environmental Advocate,activist,Promotes wildlife conservation
Amina Al Gurg,,ARE,en,Dubai,@amina_algurg,not_sure,,Environmental Advocate,activist,Focuses on sustainable business practices
Saeed Al Mulla,,ARE,en,Dubai,@saeedalmulla,not_sure,,Environmental Advocate,activist,Promotes environmental education
Hessa Al Mansoori,,ARE,en,Dubai,@hessa_almansoori,not_sure,,Environmental Advocate,activist,Focuses on renewable energy
Mariam Al Suwaidi,,ARE,en,Dubai,@mariam_alsuwaidi,not_sure,,Environmental Advocate,activist,Promotes sustainable agriculture
Omar Al Qasimi,,ARE,en,Dubai,@omar_alqasimi,not_sure,,Environmental Advocate,activist,Focuses on cultural and environmental preservation
Aisha Al Maktoum,,ARE,en,Dubai,@aisha_almaktoum,not_sure,,Environmental Advocate,activist,Promotes wildlife conservation
Hind Al Gurg,,ARE,en,Dubai,@hind_algurg,not_sure,,Environmental Advocate,activist,Focuses on sustainable business practices
Abdullah Al Mulla,,ARE,en,Dubai,@abdullahalmulla,not_sure,,Environmental Advocate,activist,Promotes environmental education
Latifa Al Mansoori,,ARE,en,Dubai,@latifa_almansoori,not_sure,,Environmental Advocate,activist,Focuses on renewable energy
Mona Al Suwaidi,,ARE,en,Dubai,@mona_alsuwaidi,not_sure,,Environmental Advocate,activist,Promotes sustainable agriculture
Rashid Al Qasimi,,ARE,en,Dubai,@rashid_alqasimi,not_sure,,Environmental Advocate,activist,Focuses on cultural and environmental preservation
Amina Al Maktoum,,ARE,en,Dubai,@amina_almaktoum,not_sure,,Environmental Advocate,activist,Promotes wildlife conservation
Saeed Al Gurg,,ARE,en,Dubai,@saeed_algurg,not_sure,,Environmental Advocate,activist,Focuses on sustainable business practices
Hessa Al Mulla,,ARE,en,Dubai,@hessa_almulla,not_sure,,Environmental Advocate,activist,Promotes environmental education
Mariam Al Mansoori,,ARE,en,Dubai,@mariam_almansoori,not_sure,,Environmental Advocate,activist,Focuses on renewable energy
Omar Al Suwaidi,,ARE,en,Dubai,@omar_alsuwaidi,not_sure,,Environmental Advocate,activist,Promotes sustainable agriculture
Aisha Al Qasimi,,ARE,en,Dubai,@aisha_alqasimi,not_sure,,Environmental Advocate,activist,Focuses on cultural and environmental preservation
Hind Al Maktoum,,ARE,en,Dubai,@hind_almaktoum,not_sure,,Environmental Advocate,activist,Promotes wildlife conservation
Abdullah Al Gurg,,ARE,en,Dubai,@abdullah_algurg,not_sure,,Environmental Advocate,activist,Focuses on sustainable business practices
