name,email,country,language,city,instagram,phone,organization,type,notes
The Green Hour,,PAK,ur,Karachi,@thegreenhourpodcast,,The Green Hour,podcaster,Focuses on environmental issues in Pakistan
Karachi Climate Conversations,,PAK,ur,Karachi,@karachiclimateconversations,,Karachi Climate Conversations,podcaster,Discusses climate change impacts in Karachi
Peaceful Pakistan Podcast,,PAK,ur,Karachi,@peacefulpakistanpod,,Peaceful Pakistan,podcaster,Covers peace and conflict resolution topics
Nature's Voice Pakistan,,PAK,ur,Karachi,@naturesvoicepak,,Nature's Voice,podcaster,Explores biodiversity and conservation efforts
GeoPolitics Today,,PAK,ur,Karachi,@geopoliticstoday,,GeoPolitics Today,podcaster,Analyzes international affairs and geopolitics
Eco Warriors Pakistan,,PAK,ur,Karachi,@ecowarriorspak,,Eco Warriors,podcaster,Promotes sustainable living and eco-friendly practices
Karachi Peace Talks,,PAK,ur,Karachi,@karachipeacetalks,,Karachi Peace Talks,podcaster,Focuses on peace initiatives in Karachi
The Climate Frontline,,PAK,ur,Karachi,@theclimatefrontline,,The Climate Frontline,podcaster,Discusses frontline climate change issues
Biodiversity Buzz,,PAK,ur,Karachi,@biodiversitybuzz,,Biodiversity Buzz,podcaster,Covers biodiversity topics in Pakistan
Karachi Geopolitical Insights,,PAK,ur,Karachi,@karachigeopoliticalinsights,,Karachi Geopolitical Insights,podcaster,Provides insights on geopolitical issues
Sustainable Karachi,,PAK,ur,Karachi,@sustainablekarachi,,Sustainable Karachi,podcaster,Promotes sustainability in urban settings
Peaceful Dialogues,,PAK,ur,Karachi,@peacefuldialogues,,Peaceful Dialogues,podcaster,Engages in dialogues on peace and harmony
Karachi Nature Network,,PAK,ur,Karachi,@karachinaturenetwork,,Karachi Nature Network,podcaster,Focuses on nature conservation efforts
Climate Action Karachi,,PAK,ur,Karachi,@climateactionkarachi,,Climate Action Karachi,podcaster,Advocates for climate action in Karachi
The Peace Podcast,,PAK,ur,Karachi,@thepeacepodcast,,The Peace Podcast,podcaster,Discusses peace-building strategies
Karachi Environmental Voices,,PAK,ur,Karachi,@karachienvironmentalvoices,,Karachi Environmental Voices,podcaster,Covers environmental issues in Karachi
Geo-Political Pulse,,PAK,ur,Karachi,@geopoliticalpulse,,Geo-Political Pulse,podcaster,Analyzes geopolitical trends and impacts
Karachi Biodiversity Hub,,PAK,ur,Karachi,@karachibiodiversityhub,,Karachi Biodiversity Hub,podcaster,Focuses on biodiversity conservation
Climate Change Chronicles,,PAK,ur,Karachi,@climatechangechronicles,,Climate Change Chronicles,podcaster,Explores climate change narratives
Peaceful Karachi,,PAK,ur,Karachi,@peacefulkarachi,,Peaceful Karachi,podcaster,Promotes peace initiatives in Karachi
Karachi Eco Talks,,PAK,ur,Karachi,@karachiecotalks,,Karachi Eco Talks,podcaster,Discusses eco-friendly practices in Karachi
The Geopolitical Lens,,PAK,ur,Karachi,@thegeopoliticallens,,The Geopolitical Lens,podcaster,Focuses on geopolitical analysis
Karachi Climate Voices,,PAK,ur,Karachi,@karachiclimatevoices,,Karachi Climate Voices,podcaster,Amplifies climate change voices in Karachi
Nature's Guardians,,PAK,ur,Karachi,@naturesguardians,,Nature's Guardians,podcaster,Focuses on nature conservation efforts
Peace and Harmony Podcast,,PAK,ur,Karachi,@peaceandharmonypodcast,,Peace and Harmony Podcast,podcaster,Promotes peace and harmony discussions
Karachi Environmental Talks,,PAK,ur,Karachi,@karachienvironmentaltalks,,Karachi Environmental Talks,podcaster,Covers environmental topics in Karachi
Geo-Political Conversations,,PAK,ur,Karachi,@geopoliticalconversations,,Geo-Political Conversations,podcaster,Discusses geopolitical issues and impacts
Karachi Biodiversity Talks,,PAK,ur,Karachi,@karachibiodiversitytalks,,Karachi Biodiversity Talks,podcaster,Focuses on biodiversity topics in Karachi
Climate Change Karachi,,PAK,ur,Karachi,@climatechangekarachi,,Climate Change Karachi,podcaster,Discusses climate change impacts in Karachi
Peaceful Dialogues Karachi,,PAK,ur,Karachi,@peacefuldialogueskarachi,,Peaceful Dialogues Karachi,podcaster,Engages in peace dialogues in Karachi
Karachi Nature Talks,,PAK,ur,Karachi,@karachinaturetalks,,Karachi Nature Talks,podcaster,Focuses on nature conservation in Karachi
The Climate Podcast,,PAK,ur,Karachi,@theclimatepodcast,,The Climate Podcast,podcaster,Explores climate change narratives
Karachi Peace Podcast,,PAK,ur,Karachi,@karachipeacepodcast,,Karachi Peace Podcast,podcaster,Promotes peace initiatives in Karachi
Eco-Friendly Karachi,,PAK,ur,Karachi,@ecofriendlykarachi,,Eco-Friendly Karachi,podcaster,Discusses eco-friendly practices in Karachi
Geopolitical Karachi,,PAK,ur,Karachi,@geopoliticalkarachi,,Geopolitical Karachi,podcaster,Focuses on geopolitical analysis in Karachi
Karachi Climate Hub,,PAK,ur,Karachi,@karachiclimatehub,,Karachi Climate Hub,podcaster,Amplifies climate change voices in Karachi
Nature's Guardians Karachi,,PAK,ur,Karachi,@naturesguardianskarachi,,Nature's Guardians Karachi,podcaster,Focuses on nature conservation efforts
Peace and Harmony Karachi,,PAK,ur,Karachi,@peaceandharmonykarachi,,Peace and Harmony Karachi,podcaster,Promotes peace and harmony discussions
Karachi Biodiversity Network,,PAK,ur,Karachi,@karachibiodiversitynetwork,,Karachi Biodiversity Network,podcaster,Focuses on biodiversity conservation
Climate Change Chronicles Karachi,,PAK,ur,Karachi,@climatechangechronicleskarachi,,Climate Change Chronicles Karachi,podcaster,Explores climate change narratives
Peaceful Karachi Dialogues,,PAK,ur,Karachi,@peacefulkarachidialogues,,Peaceful Karachi Dialogues,podcaster,Engages in peace dialogues in Karachi
The Climate Frontline Karachi,,PAK,ur,Karachi,@theclimatefrontlinekarachi,,The Climate Frontline Karachi,podcaster,Discusses frontline climate change issues
Peaceful Pakistan Karachi,,PAK,ur,Karachi,@peacefulpakistankhi,,Peaceful Pakistan Karachi,podcaster,Covers peace and conflict resolution topics
Nature's Voice Karachi,,PAK,ur,Karachi,@naturesvoicekarachi,,Nature's Voice Karachi,podcaster,Explores biodiversity and conservation efforts
GeoPolitics Today Karachi,,PAK,ur,Karachi,@geopoliticstodaykhi,,GeoPolitics Today Karachi,podcaster,Analyzes international affairs and geopolitics
Eco Warriors Karachi,,PAK,ur,Karachi,@ecowarriorskarachi,,Eco Warriors Karachi,podcaster,Promotes sustainable living and eco-friendly practices
Shoaib Ahmed,,PAK,ur,Karachi,@shoaibahmedpodcast,,The Green Talk,podcaster,Hosts top climate podcast in Karachi
Ayesha Khan,,PAK,ur,Karachi,@ayeshakhanpod,,Peaceful Waves,podcaster,Focuses on peace and conflict resolution
Zainab Ali,,PAK,ur,Karachi,@zainabali_podcast,,Nature's Voice,podcaster,Covers biodiversity and conservation
Ali Raza,,PAK,ur,Karachi,@alirazapod,,GeoPolitics Today,podcaster,Discusses geopolitics and international affairs
Fatima Noor,,PAK,ur,Karachi,@fatimanoorpodcast,,Climate Conversations,podcaster,Engages in climate change discussions
Hassan Javed,,PAK,ur,Karachi,@hassanjavedpod,,Peace Talks,podcaster,Explores peace initiatives in the region
Sara Malik,,PAK,ur,Karachi,@saramalikpodcast,,Eco Warriors,podcaster,Focuses on environmental protection
Usman Tariq,,PAK,ur,Karachi,@usmantariqpod,,World Affairs,podcaster,Covers international relations and geopolitics
Nida Khan,,PAK,ur,Karachi,@nidakhantalks,,Nature Speaks,podcaster,Discusses nature conservation efforts
Bilal Ahmed,,PAK,ur,Karachi,@bilalahmedpod,,Peaceful Dialogues,podcaster,Focuses on peace and diplomacy
Rabia Siddiqui,,PAK,ur,Karachi,@rabiasiddiquipod,,Climate Action,podcaster,Covers climate action and sustainability
Imran Khan,,PAK,ur,Karachi,@imrankhanpodcast,,Global Perspectives,podcaster,Discusses global geopolitical issues
Mariam Ali,,PAK,ur,Karachi,@mariamali_pod,,Eco Talks,podcaster,Focuses on ecological issues
Faisal Qureshi,,PAK,ur,Karachi,@faisalqureshipod,,Peaceful Solutions,podcaster,Explores solutions for peace
Zara Khan,,PAK,ur,Karachi,@zarakhanpod,,Nature's Call,podcaster,Discusses nature and wildlife conservation
Omar Farooq,,PAK,ur,Karachi,@omarfarooqpod,,Climate Voices,podcaster,Engages in climate change advocacy
Hina Shah,,PAK,ur,Karachi,@hinashahpod,,Peaceful Futures,podcaster,Focuses on future peace initiatives
Adnan Malik,,PAK,ur,Karachi,@adnanmalikpod,,Geo Talks,podcaster,Covers geopolitical discussions
Sana Ahmed,,PAK,ur,Karachi,@sanaahmedpod,,Eco Voices,podcaster,Focuses on environmental issues
Rizwan Khan,,PAK,ur,Karachi,@rizwankhanpod,,Peace Dialogues,podcaster,Explores peace and conflict resolution
Amina Sheikh,,PAK,ur,Karachi,@aminasheikhpod,,Nature's Path,podcaster,Discusses nature conservation
Kashif Ali,,PAK,ur,Karachi,@kashifalipod,,Climate Change Talks,podcaster,Engages in climate change discussions
Naveed Hussain,,PAK,ur,Karachi,@naveedhussainpod,,Peaceful World,podcaster,Focuses on global peace initiatives
Sadia Khan,,PAK,ur,Karachi,@sadiakhanpod,,Eco Awareness,podcaster,Covers environmental awareness
Tariq Mehmood,,PAK,ur,Karachi,@tariqmehmoodpod,,Geo Insights,podcaster,Discusses geopolitical insights
Zainab Raza,,PAK,ur,Karachi,@zainabraza_pod,,Nature's Voice,podcaster,Focuses on nature conservation
Asad Ali,,PAK,ur,Karachi,@asadali_podcast,,Climate Talks,podcaster,Engages in climate change advocacy
Hira Shah,,PAK,ur,Karachi,@hirashahpod,,Peaceful Dialogues,podcaster,Explores peace initiatives
Waqas Ahmed,,PAK,ur,Karachi,@waqasahmedpod,,Eco Warriors,podcaster,Focuses on environmental protection
Saba Qureshi,,PAK,ur,Karachi,@sabaqureshipod,,Geo Politics,podcaster,Discusses geopolitical issues
Adeel Khan,,PAK,ur,Karachi,@adeelkhanpod,,Nature's Call,podcaster,Focuses on nature conservation
Nida Ali,,PAK,ur,Karachi,@nidaalipod,,Climate Conversations,podcaster,Engages in climate discussions
Fahad Raza,,PAK,ur,Karachi,@fahadrazapod,,Peaceful Solutions,podcaster,Explores solutions for peace
Zoya Khan,,PAK,ur,Karachi,@zoyakhanpod,,Eco Talks,podcaster,Focuses on ecological issues
Hamza Tariq,,PAK,ur,Karachi,@hamzatariqpod,,Geo Talks,podcaster,Covers geopolitical discussions
Sana Raza,,PAK,ur,Karachi,@sanarazapod,,Nature Speaks,podcaster,Discusses nature conservation efforts
Ali Hassan,,PAK,ur,Karachi,@alihassanpod,,Climate Voices,podcaster,Engages in climate change advocacy
Nashit Khan,,PAK,ur,Karachi,@nashitkhanpod,,Peaceful Futures,podcaster,Focuses on future peace initiatives
Maira Ali,,PAK,ur,Karachi,@mairaalipod,,Eco Voices,podcaster,Focuses on environmental issues
Raza Ahmed,,PAK,ur,Karachi,@razaahmedpod,,Peace Dialogues,podcaster,Explores peace and conflict resolution
Ayesha Siddiqui,,PAK,ur,Karachi,@ayeshapod,,Nature's Path,podcaster,Discusses nature conservation
Kashif Mehmood,,PAK,ur,Karachi,@kashifmehmoodpod,,Climate Change Talks,podcaster,Engages in climate change discussions
Naveed Ali,,PAK,ur,Karachi,@naveedalipod,,Peaceful World,podcaster,Focuses on global peace initiatives
Sadia Raza,,PAK,ur,Karachi,@sadiarazapod,,Eco Awareness,podcaster,Covers environmental awareness
Tariq Ali,,PAK,ur,Karachi,@tariqalipod,,Geo Insights,podcaster,Discusses geopolitical insights
Zainab Mehmood,,PAK,ur,Karachi,@zainabmehmoodpod,,Nature's Voice,podcaster,Focuses on nature conservation
Asad Raza,,PAK,ur,Karachi,@asadrazapod,,Climate Talks,podcaster,Engages in climate change advocacy
Hira Ali,,PAK,ur,Karachi,@hiraalipod,,Peaceful Dialogues,podcaster,Explores peace initiatives
Waqas Khan,,PAK,ur,Karachi,@waqaskhanpod,,Eco Warriors,podcaster,Focuses on environmental protection
Saba Ali,,PAK,ur,Karachi,@sabaalipod,,Geo Politics,podcaster,Discusses geopolitical issues
Adeel Raza,,PAK,ur,Karachi,@adeelrazapod,,Nature's Call,podcaster,Focuses on nature conservation
Nida Raza,,PAK,ur,Karachi,@nidarazapod,,Climate Conversations,podcaster,Engages in climate discussions
Fahad Khan,,PAK,ur,Karachi,@fahadkhanpod,,Peaceful Solutions,podcaster,Explores solutions for peace
Zoya Raza,,PAK,ur,Karachi,@zoyarazapod,,Eco Talks,podcaster,Focuses on ecological issues
