name,email,country,language,city,instagram,phone,organization,type,notes
Green Hong Kong Podcast,,KON,en,Hong,@greenhkpodcast,,Green Hong Kong Podcast,podcaster,Focuses on local environmental issues
The Climate Conversation,,KON,en,Hong,@climateconversationhk,,The Climate Conversation,podcaster,Discusses climate change impacts in HK
Hong Kong Nature Talks,,KON,en,Hong,@hknaturetalks,,Hong Kong Nature Talks,podcaster,Covers biodiversity and conservation topics
Peaceful Waves Podcast,,KON,en,Hong,@peacefulwaveshk,,Peaceful Waves Podcast,podcaster,Focuses on peace and conflict resolution
Geopolitics in Asia,,KON,en,Hong,@geopoliticsasia,,Geopolitics in Asia,podcaster,Analyzes geopolitical trends in Asia
Eco Warriors Hong Kong,,KON,en,Hong,@ecowarriorshk,,Eco Warriors Hong Kong,podcaster,Promotes sustainable living practices
Sustainable Future Podcast,,KON,en,Hong,@sustainablefuturehk,,Sustainable Future Podcast,podcaster,Explores sustainability initiatives in HK
Hong Kong Climate Voices,,KON,en,Hong,@hkclimatevoices,,Hong Kong Climate Voices,podcaster,Shares stories on climate action
The Peace Podcast HK,,KON,en,Hong,@peacepodcasthk,,The Peace Podcast HK,podcaster,Discusses peacebuilding efforts
Biodiversity Buzz,,KON,en,Hong,@biodiversitybuzzhk,,Biodiversity Buzz,podcaster,Focuses on biodiversity in Hong Kong
Hong Kong Green Voices,,KON,en,Hong,@hkgreenvoices,,Hong Kong Green Voices,podcaster,Covers environmental advocacy
Asia Pacific Geopolitics,,KON,en,Hong,@asiapacificgeopolitics,,Asia Pacific Geopolitics,podcaster,Discusses regional geopolitical issues
Eco Chat HK,,KON,en,Hong,@ecochathk,,Eco Chat HK,podcaster,Talks about eco-friendly practices
Hong Kong Peace Talks,,KON,en,Hong,@hkpeacetalks,,Hong Kong Peace Talks,podcaster,Focuses on peace initiatives
Climate Action HK,,KON,en,Hong,@climateactionhk,,Climate Action HK,podcaster,Promotes climate action in Hong Kong
Nature's Voice HK,,KON,en,Hong,@naturesvoicehk,,Nature's Voice HK,podcaster,Covers nature conservation topics
Hong Kong Geopolitical Insights,,KON,en,Hong,@hkgeopoliticalinsights,,Hong Kong Geopolitical Insights,podcaster,Analyzes geopolitical dynamics
Sustainable Hong Kong Podcast,,KON,en,Hong,@sustainablehkpodcast,,Sustainable Hong Kong Podcast,podcaster,Discusses sustainability in HK
Peace and Harmony Podcast,,KON,en,Hong,@peaceandharmonyhk,,Peace and Harmony Podcast,podcaster,Focuses on peacebuilding
Hong Kong Climate Change Podcast,,KON,en,Hong,@hkclimatechangepodcast,,Hong Kong Climate Change Podcast,podcaster,Discusses climate change impacts
Biodiversity Hong Kong,,KON,en,Hong,@biodiversityhk,,Biodiversity Hong Kong,podcaster,Focuses on biodiversity conservation
Green Future HK,,KON,en,Hong,@greenfuturehk,,Green Future HK,podcaster,Promotes green initiatives
Hong Kong Peace Podcast,,KON,en,Hong,@hkpeacepodcast,,Hong Kong Peace Podcast,podcaster,Discusses peace efforts
Geopolitical Conversations HK,,KON,en,Hong,@geopoliticalconversationshk,,Geopolitical Conversations HK,podcaster,Analyzes geopolitical issues
Eco Warriors Podcast,,KON,en,Hong,@ecowarriorspodcast,,Eco Warriors Podcast,podcaster,Promotes eco-friendly living
Hong Kong Nature Podcast,,KON,en,Hong,@hknaturepodcast,,Hong Kong Nature Podcast,podcaster,Covers nature conservation topics
Climate Voices HK,,KON,en,Hong,@climatevoiceshk,,Climate Voices HK,podcaster,Shares climate action stories
Peaceful Hong Kong Podcast,,KON,en,Hong,@peacefulhkpodcast,,Peaceful Hong Kong Podcast,podcaster,Focuses on peace initiatives
Sustainable Living HK,,KON,en,Hong,@sustainablelivinghk,,Sustainable Living HK,podcaster,Promotes sustainable practices
Hong Kong Geopolitical Podcast,,KON,en,Hong,@hkgeopoliticalpodcast,,Hong Kong Geopolitical Podcast,podcaster,Discusses geopolitical dynamics
Eco Hong Kong Podcast,,KON,en,Hong,@ecohongkongpodcast,,Eco Hong Kong Podcast,podcaster,Focuses on environmental issues
Nature Talks HK,,KON,en,Hong,@naturetalkshk,,Nature Talks HK,podcaster,Covers biodiversity topics
Climate Action Podcast,,KON,en,Hong,@climateactionpodcast,,Climate Action Podcast,podcaster,Promotes climate action
Peace and Conflict HK,,KON,en,Hong,@peaceandconflicthk,,Peace and Conflict HK,podcaster,Focuses on conflict resolution
Biodiversity Podcast HK,,KON,en,Hong,@biodiversitypodcasthk,,Biodiversity Podcast HK,podcaster,Discusses biodiversity conservation
Green Hong Kong Voices,,KON,en,Hong,@greenhkvoices,,Green Hong Kong Voices,podcaster,Covers environmental advocacy
Geopolitics and Asia,,KON,en,Hong,@geopoliticsandasia,,Geopolitics and Asia,podcaster,Analyzes regional geopolitical issues
Eco Chat Podcast,,KON,en,Hong,@ecochatpodcast,,Eco Chat Podcast,podcaster,Talks about eco-friendly practices
Hong Kong Peace and Harmony,,KON,en,Hong,@hkpeaceandharmony,,Hong Kong Peace and Harmony,podcaster,Focuses on peacebuilding
Climate Change HK Podcast,,KON,en,Hong,@climatechangehkpodcast,,Climate Change HK Podcast,podcaster,Discusses climate change impacts
Biodiversity and Nature HK,,KON,en,Hong,@biodiversityandnaturehk,,Biodiversity and Nature HK,podcaster,Focuses on biodiversity conservation
Green Future Podcast,,KON,en,Hong,@greenfuturepodcast,,Green Future Podcast,podcaster,Promotes green initiatives
Hong Kong Peace and Conflict,,KON,en,Hong,@hkpeaceandconflict,,Hong Kong Peace and Conflict,podcaster,Discusses peace efforts
Geopolitical Insights HK,,KON,en,Hong,@geopoliticalinsightshk,,Geopolitical Insights HK,podcaster,Analyzes geopolitical issues
Eco Warriors HK Podcast,,KON,en,Hong,@ecowarriorshkpodcast,,Eco Warriors HK Podcast,podcaster,Promotes eco-friendly living
Hong Kong Nature and Biodiversity,,KON,en,Hong,@hknatureandbiodiversity,,Hong Kong Nature and Biodiversity,podcaster,Covers nature conservation topics
Climate Voices Podcast,,KON,en,Hong,@climatevoicespodcast,,Climate Voices Podcast,podcaster,Shares climate action stories
Peaceful Hong Kong,,KON,en,Hong,@peacefulhongkong,,Peaceful Hong Kong,podcaster,Focuses on peace initiatives
Sustainable Living Podcast,,KON,en,Hong,@sustainablelivingpodcast,,Sustainable Living Podcast,podcaster,Promotes sustainable practices
Hong Kong Geopolitical Conversations,,KON,en,Hong,@hkgeopoliticalconversations,,Hong Kong Geopolitical Conversations,podcaster,Discusses geopolitical dynamics
Eco Hong Kong,,KON,en,Hong,@ecohongkong,,Eco Hong Kong,podcaster,Focuses on environmental issues
Nature Talks Podcast,,KON,en,Hong,@naturetalkspodcast,,Nature Talks Podcast,podcaster,Covers biodiversity topics
Climate Action HK Podcast,,KON,en,Hong,@climateactionhkpodcast,,Climate Action HK Podcast,podcaster,Promotes climate action
Peace and Conflict Podcast,,KON,en,Hong,@peaceandconflictpodcast,,Peace and Conflict Podcast,podcaster,Focuses on conflict resolution
Biodiversity Podcast,,KON,en,Hong,@biodiversitypodcast,,Biodiversity Podcast,podcaster,Discusses biodiversity conservation
Green Voices HK,,KON,en,Hong,@greenvoiceshk,,Green Voices HK,podcaster,Covers environmental advocacy
Geopolitics and Asia Podcast,,KON,en,Hong,@geopoliticsandasiapodcast,,Geopolitics and Asia Podcast,podcaster,Analyzes regional geopolitical issues
Eco Chat HK Podcast,,KON,en,Hong,@ecochathkpodcast,,Eco Chat HK Podcast,podcaster,Talks about eco-friendly practices
Hong Kong Peace and Harmony Podcast,,KON,en,Hong,@hkpeaceandharmonypodcast,,Hong Kong Peace and Harmony Podcast,podcaster,Focuses on peacebuilding
Climate Change Podcast HK,,KON,en,Hong,@climatechangepodcasthk,,Climate Change Podcast HK,podcaster,Discusses climate change impacts
Biodiversity and Nature Podcast,,KON,en,Hong,@biodiversityandnaturepodcast,,Biodiversity and Nature Podcast,podcaster,Focuses on biodiversity conservation
Green Future HK Podcast,,KON,en,Hong,@greenfuturehkpodcast,,Green Future HK Podcast,podcaster,Promotes green initiatives
Hong Kong Peace and Conflict Podcast,,KON,en,Hong,@hkpeaceandconflictpodcast,,Hong Kong Peace and Conflict Podcast,podcaster,Discusses peace efforts
Geopolitical Insights Podcast,,KON,en,Hong,@geopoliticalinsightspodcast,,Geopolitical Insights Podcast,podcaster,Analyzes geopolitical issues
Hong Kong Nature and Biodiversity Podcast,,KON,en,Hong,@hknatureandbiodiversitypodcast,,Hong Kong Nature and Biodiversity Podcast,podcaster,Covers nature conservation topics
Climate Voices HK Podcast,,KON,en,Hong,@climatevoiceshkpodcast,,Climate Voices HK Podcast,podcaster,Shares climate action stories
Sustainable Living HK Podcast,,KON,en,Hong,@sustainablelivinghkpodcast,,Sustainable Living HK Podcast,podcaster,Promotes sustainable practices
Hong Kong Geopolitical Conversations Podcast,,KON,en,Hong,@hkgeopoliticalconversationspodcast,,Hong Kong Geopolitical Conversations Podcast,podcaster,Discusses geopolitical dynamics
Nature Talks HK Podcast,,KON,en,Hong,@naturetalkshkpodcast,,Nature Talks HK Podcast,podcaster,Covers biodiversity topics
Climate Action Podcast HK,,KON,en,Hong,@climateactionpodcasthk,,Climate Action Podcast HK,podcaster,Promotes climate action
Peace and Conflict HK Podcast,,KON,en,Hong,@peaceandconflicthkpodcast,,Peace and Conflict HK Podcast,podcaster,Focuses on conflict resolution
Green Voices HK Podcast,,KON,en,Hong,@greenvoiceshkpodcast,,Green Voices HK Podcast,podcaster,Covers environmental advocacy
Geopolitics and Asia HK,,KON,en,Hong,@geopoliticsandasiakhk,,Geopolitics and Asia HK,podcaster,Analyzes regional geopolitical issues
Eco Chat Podcast HK,,KON,en,Hong,@ecochatpodcasthk,,Eco Chat Podcast HK,podcaster,Talks about eco-friendly practices
Hong Kong Peace and Harmony Podcast,,KON,en,Hong,@hkpeaceandharmonypodcasthk,,Hong Kong Peace and Harmony Podcast,podcaster,Focuses on peacebuilding
Biodiversity and Nature Podcast HK,,KON,en,Hong,@biodiversityandnaturepodcasthk,,Biodiversity and Nature Podcast HK,podcaster,Focuses on biodiversity conservation
Green Future HK Podcast,,KON,en,Hong,@greenfuturehkpodcasthk,,Green Future HK Podcast,podcaster,Promotes green initiatives
Hong Kong Peace and Conflict Podcast,,KON,en,Hong,@hkpeaceandconflictpodcasthk,,Hong Kong Peace and Conflict Podcast,podcaster,Discusses peace efforts
Geopolitical Insights Podcast HK,,KON,en,Hong,@geopoliticalinsightspodcasthk,,Geopolitical Insights Podcast HK,podcaster,Analyzes geopolitical issues
Eco Warriors HK Podcast,,KON,en,Hong,@ecowarriorshkpodcasthk,,Eco Warriors HK Podcast,podcaster,Promotes eco-friendly living
Hong Kong Nature and Biodiversity Podcast,,KON,en,Hong,@hknatureandbiodiversitypodcasthk,,Hong Kong Nature and Biodiversity Podcast,podcaster,Covers nature conservation topics
Climate Voices HK Podcast,,KON,en,Hong,@climatevoiceshkpodcasthk,,Climate Voices HK Podcast,podcaster,Shares climate action stories
Peaceful Hong Kong Podcast,,KON,en,Hong,@peacefulhkpodcasthk,,Peaceful Hong Kong Podcast,podcaster,Focuses on peace initiatives
Sustainable Living HK Podcast,,KON,en,Hong,@sustainablelivinghkpodcasthk,,Sustainable Living HK Podcast,podcaster,Promotes sustainable practices
Hong Kong Geopolitical Conversations Podcast,,KON,en,Hong,@hkgeopoliticalconversationspodcasthk,,Hong Kong Geopolitical Conversations Podcast,podcaster,Discusses geopolitical dynamics
Eco Hong Kong Podcast,,KON,en,Hong,@ecohongkongpodcasthk,,Eco Hong Kong Podcast,podcaster,Focuses on environmental issues
Nature Talks HK Podcast,,KON,en,Hong,@naturetalkshkpodcasthk,,Nature Talks HK Podcast,podcaster,Covers biodiversity topics
Peace and Conflict HK Podcast,,KON,en,Hong,@peaceandconflicthkpodcasthk,,Peace and Conflict HK Podcast,podcaster,Focuses on conflict resolution
Green Voices HK Podcast,,KON,en,Hong,@greenvoiceshkpodcasthk,,Green Voices HK Podcast,podcaster,Covers environmental advocacy
Angie Lau,,KON,en,Hong,@angie_lau,,Forkast.News,podcaster,Hosts geopolitics and tech podcast
Jason Y. Ng,,KON,en,Hong,@jasonyng,,Hong Kong Free Press,podcaster,Covers Hong Kong politics and society
Vivienne Chow,,KON,en,Hong,@viviennechow,,Cultural journalist and podcaster,podcaster,Focuses on cultural geopolitics
Karin Malmstrom,,KON,en,Hong,@karinmalmstrom,,Woolmark Company,podcaster,Discusses sustainable fashion
Stephen Davies,,KON,en,Hong,@stephendavies,,Marine historian and podcaster,podcaster,Covers maritime history and conservation
Rachel Cartland,,KON,en,Hong,@rachelcartland,,Author and commentator,podcaster,Discusses Hong Kong governance
Nury Vittachi,,KON,en,Hong,@nuryvittachi,,Author and humorist,podcaster,Covers Asian geopolitics with humor
Chloe Lai,,KON,en,Hong,@chloelai,,Urbanist and environmentalist,podcaster,Focuses on urban sustainability
Tom Grundy,,KON,en,Hong,@tomgrundy,,Hong Kong Free Press,podcaster,Covers Hong Kong news and politics
Kylie Knott,,KON,en,Hong,@kylieknott,,Lifestyle editor and podcaster,podcaster,Discusses sustainable living
Andrew Work,,KON,en,Hong,@andrewwork,,Harbour Times,podcaster,Covers Hong Kong business and politics
