name,email,country,language,city,instagram,phone,organization,type,notes
Vandana Shiva,,IND,hi,Delhi,@drvandanashiva,,Navdanya,influencer,Renowned environmental activist and author
Sunita Narain,,IND,hi,Delhi,@sunitanarain.cse,,Centre for Science and Environment,influencer,"Director of CSE, climate expert"
Ridhima Pandey,,IND,hi,Delhi,@ridhimapandey,,Youth Climate Activist,influencer,"Young climate activist, global voice"
Prerna Bindra,,IND,hi,Delhi,@prernabindra,,Wildlife Conservationist,influencer,Wildlife conservationist and author
Ravi Agarwal,,IND,hi,Delhi,@raviagarwal_delhi,,Toxics Link,influencer,"Environmental activist, focuses on waste management"
Bhavreen Kandhari,,IND,hi,Delhi,@bhavreenmk,,Warrior Moms,influencer,"Environmental activist, air pollution focus"
Kartikeya Singh,,IND,hi,Delhi,@kartikeya_singh,,"Council on Energy, Environment and Water",influencer,Energy and climate policy expert
Neha Sinha,,IND,hi,Delhi,@nehaa_sinha,,Conservation Biologist,influencer,"Conservation biologist, author, columnist"
Aakash Ranison,,IND,hi,Delhi,@aakashranison,,Climate Activist,influencer,"Climate activist, sustainability influencer"
Rohit Mehra,,IND,hi,Delhi,@greenmanrohit,,Green Man of India,influencer,Known for urban afforestation initiatives
Kehkashan Basu,,IND,hi,Delhi,@kehkashanb,,Green Hope Foundation,influencer,"Youth environmental activist, UN Champion"
Sambhavna Seth,,IND,hi,Delhi,@sambhavnasethofficial,,Actress and Activist,influencer,Promotes environmental awareness
Manoj Misra,,IND,hi,Delhi,@yamunajiye,,Yamuna Jiye Abhiyaan,influencer,"River conservationist, Yamuna river focus"
Richa Singh,,IND,hi,Delhi,@richasingh,,Youth Ki Awaaz,influencer,"Social activist, climate change advocate"
Siddharth Agarwal,,IND,hi,Delhi,@siddharthagarwal,,Veditum India Foundation,influencer,Focus on river conservation and water issues
Anumita Roychowdhury,,IND,hi,Delhi,@anumitaroychowdhury,,Centre for Science and Environment,influencer,Air pollution and climate policy expert
Ravi Chellam,,IND,hi,Delhi,@ravichellam,,Biodiversity Expert,influencer,"Wildlife biologist, conservation policy"
Rohini Nilekani,,IND,hi,Delhi,@rohininilekani,,Philanthropist and Author,influencer,Focus on water and environment
Vikram Aditya,,IND,hi,Delhi,@vikramaditya,,Wildlife Filmmaker,influencer,"Wildlife filmmaker, conservation advocate"
Sanjay Upadhyay,,IND,hi,Delhi,@sanjayupadhyay,,Environmental Lawyer,influencer,Environmental law and policy expert
Madhur Anand,,IND,hi,Delhi,@madhuranand,,Ecologist and Poet,influencer,"Ecologist, writes on nature and environment"
Rina Mukherji,,IND,hi,Delhi,@rinamukherji,,Journalist and Author,influencer,Writes on climate change and environment
Suresh Heblikar,,IND,hi,Delhi,@sureshheblikar,,Filmmaker and Environmentalist,influencer,Environmental films and activism
Anjali Gopalan,,IND,hi,Delhi,@anjaligopalan,,Naz Foundation,influencer,"Social activist, environmental advocate"
Nandita Das,,IND,hi,Delhi,@nanditadasofficial,,Actress and Activist,influencer,Promotes social and environmental causes
Ranjit Barthakur,,IND,hi,Delhi,@ranjitbarthakur,,Balipara Foundation,influencer,Biodiversity conservation advocate
Kiran Bedi,,IND,hi,Delhi,@kiranbediofficial,,Social Activist,influencer,Promotes environmental awareness
Gaurav Gupta,,IND,hi,Delhi,@gauravgupta,,Fashion Designer,influencer,Sustainable fashion advocate
Rakesh Khatri,,IND,hi,Delhi,@rakeshkhatri,,Eco Roots Foundation,influencer,Known for sparrow conservation efforts
Amitabh Kant,,IND,hi,Delhi,@amitabhk87,,NITI Aayog,influencer,"Policy expert, sustainable development focus"
Ravi Singh,,IND,hi,Delhi,@ravisingh_wwf,,WWF India,influencer,"CEO of WWF India, conservation leader"
Richa Chadda,,IND,hi,Delhi,@therichachadha,,Actress and Activist,influencer,Advocates for environmental issues
Dia Mirza,,IND,hi,Delhi,@diamirzaofficial,,Actress and UN Environment Goodwill Ambassador,influencer,Promotes environmental sustainability
Gul Panag,,IND,hi,Delhi,@gulpanag,,Actress and Activist,influencer,Advocates for environmental and social issues
Rohini Pande,,IND,hi,Delhi,@rohinipande,,Economist,influencer,Focus on environmental economics
Shubham Khurana,,IND,hi,Delhi,@shubhamkhurana,,Climate Activist,influencer,"Youth climate activist, social media presence"
Anshul Tewari,,IND,hi,Delhi,@anshultewari,,Youth Ki Awaaz,influencer,"Founder of Youth Ki Awaaz, social issues focus"
Rituparna Borah,,IND,hi,Delhi,@rituparnab,,Nazariya,influencer,LGBTQ+ and environmental activist
Sonal Kapoor,,IND,hi,Delhi,@sonamkapoor,,Actress and Activist,influencer,Promotes sustainable fashion and environment
Amitav Ghosh,,IND,hi,Delhi,@amitav_ghosh1,,Author,influencer,Writes on climate change and environment
Siddharth Dhanvant Shanghvi,,IND,hi,Delhi,@siddharthshanghvi,,Author,influencer,Writes on nature and environment
Nikhil Dey,,IND,hi,Delhi,@nikhildey,,Social Activist,influencer,Focus on transparency and environment
Ranjan Panda,,IND,hi,Delhi,@ranjanpanda,,Water Initiatives Odisha,influencer,Water conservation activist
Chintan Girish Modi,,IND,hi,Delhi,@chintan.girish.modi,,Peace Activist,influencer,Peace and environmental advocate
Aparajita Bharti,,IND,hi,Delhi,@aparajitab,,Young Leaders for Active Citizenship,influencer,Focus on policy and environment
Ravi Mishra,,IND,hi,Delhi,@ravimishra,,Environmental Journalist,influencer,Writes on climate and environment
Shivani Gupta,,IND,hi,Delhi,@shivani_gupta,,Environmental Activist,influencer,Focus on waste management and sustainability
Anand Patwardhan,,IND,hi,Delhi,@anandpatwardhan,,Filmmaker,influencer,Documentaries on social and environmental issues
Ravi Kalra,,IND,hi,Delhi,@ravikalra,,The Earth Saviours Foundation,influencer,Environmental and social activist
Harini Nagendra,,IND,hi,Delhi,@harini.nagendra,,Azim Premji University,influencer,"Ecologist, urban sustainability expert"
Aparajita Datta,,IND,hi,Delhi,@aparajita.datta,,Nature Conservation Foundation,influencer,"Wildlife biologist, conservationist"
Gaurav Gupta,,IND,hi,Delhi,@gauravgupta.earth,,Dalberg Advisors,influencer,"Sustainability consultant, climate strategist"
Kanchi Kohli,,IND,hi,Delhi,@kanchikohli,,Centre for Policy Research,influencer,Environmental governance researcher
Aarti Khosla,,IND,hi,Delhi,@aartikhosla,,Climate Trends,influencer,Climate communication expert
Chandra Bhushan,,IND,hi,Delhi,@chandrab01,,iFOREST,influencer,"Environmental policy expert, iFOREST CEO"
Ruchika Singh,,IND,hi,Delhi,@ruchikasingh,,World Resources Institute India,influencer,Sustainable landscapes expert
Anjali Jaiswal,,IND,hi,Delhi,@anjalijaiswal,,Natural Resources Defense Council,influencer,"Climate policy advocate, NRDC director"
Sandeep Chachra,,IND,hi,Delhi,@sandeepchachra,,ActionAid India,influencer,Social justice and climate activist
Amitabh Behar,,IND,hi,Delhi,@amitabhbehar,,Oxfam India,influencer,"CEO of Oxfam India, social justice advocate"
Kavita Kuruganti,,IND,hi,Delhi,@kavitakuruganti,,Alliance for Sustainable and Holistic Agriculture,influencer,Sustainable agriculture advocate
Siddharth Singh,,IND,hi,Delhi,@siddharth3,,Author,influencer,Author on climate change and energy
Nityanand Jayaraman,,IND,hi,Delhi,@nityjayaraman,,,influencer,Environmental activist and journalist
Ramesh Ramachandran,,IND,hi,Delhi,@rameshramachandran,,Observer Research Foundation,influencer,Geopolitics and climate expert
Harjeet Singh,,IND,hi,Delhi,@harjeetsingh_in,,Climate Action Network International,influencer,Climate policy expert
Manju Menon,,IND,hi,Delhi,@manjumenon,,Centre for Policy Research,influencer,Environmental justice researcher
Ritwick Dutta,,IND,hi,Delhi,@ritwickdutta,,Legal Initiative for Forest and Environment,influencer,Environmental lawyer and activist
Madhuresh Kumar,,IND,hi,Delhi,@madhureshkumar,,National Alliance of People's Movements,influencer,Environmental and social justice activist
Soumya Dutta,,IND,hi,Delhi,@soumyadutta,,Beyond Copenhagen Collective,influencer,Climate and energy policy expert
Bharati Chaturvedi,,IND,hi,Delhi,@bharatichaturvedi,,Chintan Environmental Research and Action Group,influencer,Environmental activist and author
Ashish Kothari,,IND,hi,Delhi,@ashishkothari,,Kalpavriksh,influencer,Environmentalist and author
Rohit Chakravarty,,IND,hi,Delhi,@rohit.chakravarty,,,influencer,Bat biologist and conservationist
Richa Agarwal,,IND,hi,Delhi,@richa_agarwal,,Greenpeace India,influencer,Climate campaigner
Manu Moudgil,,IND,hi,Delhi,@manumoudgil,,India Water Portal,influencer,Water conservation advocate
Chandni Singh,,IND,hi,Delhi,@chandnisingh,,Indian Institute for Human Settlements,influencer,Climate change adaptation researcher
Aparna Pallavi,,IND,hi,Delhi,@aparnapallavi,,Down To Earth,influencer,Environmental journalist
Madhura Joshi,,IND,hi,Delhi,@madhurajoshi,,Natural Resources Defense Council,influencer,Climate policy expert
Kumar Sambhav,,IND,hi,Delhi,@kumarsambhav,,Land Conflict Watch,influencer,Environmental journalist
Rashneh Pardiwala,,IND,hi,Delhi,@rashnehpardiwala,,Centre for Environmental Research and Education,influencer,Environmental educator
Amit Bhatt,,IND,hi,Delhi,@amitbhatt,,WRI India,influencer,Urban transport and climate expert
Kiran Pereira,,IND,hi,Delhi,@kiranpereira,,SandStories.org,influencer,Sand mining and environment expert
Sanjay Vashist,,IND,hi,Delhi,@sanjayvashist,,Climate Action Network South Asia,influencer,Climate policy expert
Harini Nagendra,,IND,hi,Delhi,@harininagendra,,Azim Premji University,influencer,Ecologist and author
Rohit Prajapati,,IND,hi,Delhi,@rohitprajapati,,Paryavaran Suraksha Samiti,influencer,Environmentalist and activist
Debadityo Sinha,,IND,hi,Delhi,@debadityo,,Vidhi Centre for Legal Policy,influencer,Environmental policy expert
Meghaa Gupta,,IND,hi,Delhi,@meghaagupta,,Author,influencer,Writes on environment and wildlife
Sandeep Das,,IND,hi,Delhi,@sandeepdas,,Wildlife Institute of India,influencer,Herpetologist and conservationist
Anand Pendharkar,,IND,hi,Delhi,@anandpendharkar,,SPROUTS Environment Trust,influencer,Environmental educator and activist
